"person","text"
"RD:","I retired from Bates in 1989, okay? This is when there was a big turnover. The mills were real low as far as money, and the (unintelligible word) was to borrow a large sum from the government, or sell out and try to keep it going, whoever's going to buy it. This is when the two Chinese brothers came in, Thomas and Eric Chang. In other words, they're more or less investors. In other words, they were backed by billions of dollars coming out of Hong Kong, and they had more money than they knew what to do with it. So they heard of this because they had acquired a mill in North Carolina by the name of Minnette, Minnette Mills in Grover, North Carolina. It's just about thirty-five miles south of Charlotte, where the airport is, North Carolina. And they came in about that time, and what they offered was to buy the shares of all the stockholders of Bates at the time. Not buy the company, buy their shares, which means the minute they bought the shares, they control, they didn't have to buy anything else. They acquired it, that way there, without buying everything. They acquired their shares, this meant they had the controlling interest by about sixty or seventy-five percent, so they owned it without buying it. I don't think they spent more than, if I can remember right, seventy or seventy five thousand dollars. And there was nothing you could do about it, it was legal. Just prior to that we had become an employee owned corporation, but it just wasn't working out. We had money on loan, and we just couldn't make the payments and this, because business at certain times of the year was, like January, business was always real low, and other times. But then at that point it was almost year round, you know, we were, we couldn't attract much of anything because I guess the whole market, the big companies were going from woven bedspreads to the comforters and other types of bedding, so the turnover, we just didn't fall into that area at the time. Because we hadn't anticipated, because we didn't have the money to go into that development for that area at that time, so it kind of ruined us at the time. So when these two brothers came in, it was like, you know, everybody on the upper echelon thought, oh, this is great, you know. But thinking about it, like some of us that knew about this, we were thinking about it and said, no, this is not going to work out. And so anyhow, it went through, they acquired the ownership by this stock majority that they acquired. And at the beginning, of the two, one was an older Chinese from the old type of family, you know, 6 he believed in family and the good things. The younger one, he was a playboy. He was brought up in all that money, and he had no responsibility, he had no background. As an example, one time he went out and bought a Rolls Royce convertible, you know, a Rolls Royce, bright red with a tan top, and never made a payment on it. The repo companies would come along and say, would you know about Mr. Tang's car? What car, you know, I'd say, you know, we've seen it in the beginning when he first came in with it but we haven't seen it since. So eventually, checking here and there, it was hidden in somebody's old garage behind some house. Never made a payment. But that's the way he was. He bought boats this way, sailboats. He had a nice one at Freeport Yacht Basin, you know, probably $2, $2.5 million job. Never made a payment on it. But that's the type of person he was. But the older one just couldn't get him to get on the right track. Because the older one, in a Chinese family, the older brother is always the keeper of the younger ones. And whatever they do, you try to correct it and you try to get them on the right track. But if you don't, he doesn't want to get on the right track there's not much you can do about it. He just has to pay the consequences and pay the debts. So that's the way those two were. But the interesting thing is, after they took over, well just before they took over they came around to look, see what there was and everything else. The plant manager at the time, Collins, says, hey, it was kind of a poor way to say this, but he said, you know, the Chinks are coming in to visit today, which was - - I said, okay, and he says, they want to go in and talk with you. I says, why? He said, well, they think you have the most interesting area of the whole complex, because this is the beginning of where everything starts. Well, okay. So they show up, and the younger one, you know, just roaming around, you know, he'd look at this and look at that and kept walking. But the older one, he'd stand there with you and you could almost tell he had a list of questions this long, and he'd say, if you did this or that, because he was high tech, if you did this with this machine here, would it do this? So I kind of looked at him, I said, yeah, it would. Okay, then he'd move on to something else and he'd say, if we did that with that operation over there, could you get these results? And, you know, think about it for a few minutes and kind of figure it out. I says, yeah, I think we could, yeah. So almost every week there for a couple of months, he would show up. He wouldn't bring the younger one, he'd show up by himself. He'd come in and he'd say, “Let's go on the other side of the sample room where it's going to be one-on-one,” he says, “let's sit down,” he says, “I got a lot of questions for you.” “Oh, okay.” First thing I know, he says, he says, “I understand you're getting ready to retire.” I says, “Yeah, at the end of the year,” which was 1946 [sic 1986]. I says, “In the month of December I'm retiring.” “Oh, you can't do that.” “No? Why not?” I had thought of this ahead of time, and I had checked with different people on the State level and so forth, I said, “There's a chance to go to consultant, instant consultant.” So I says, “Well,” I says, “okay, Thomas,” I says, “talk to me.” I said, “I'm going to retire in December. Either I'm going to fade away, or go to somebody else.” You know, that kind of caught his attention. He said, “Who else?” I said, “Well, I have friends at Fieldcrest and Cannon Mills, West Point Pepperell, that, you know, I could easily, on a part time basis.” “Oh, no, no, you can't do that.” He said, “How about you becoming a consultant for us, exclusively?” “Well,” I said, “okay.” He said, “You got a fee?” And I says, “Yeah, okay, I got a fee,” I says. The fee would be so much plus expenses, and I'll give you one week a month, one solid week a month and that's it, for this fee. And I kind of see the figures in his . . . . “Fine,” he said, “actually you could have started higher if you wanted to.” 7 I said, well, you could do that yourself, I said, you could increase, you know, so that way there it would be kind of a mutual agreement. He said, well, let's give it about six months, and then, he said, we'll, but he said, also I'm going to throw in your living quarters when you come down, and he says, you're going to have an office down at (name) Mills in North Carolina, you're going to have your own office down there. Then he says, over here, well, there's still going to be your office in the designing department there. So I said, (unintelligible word), how about the management here? He said, well, don't worry about management, because you're going to be above this manager, you're going to be working for me, you're going to be my assistant. You know, you're not going to be a vice president or nothing, but you're going to be over everybody, so he said, don't worry about the plant manager or the vice president, see, because you're going to be over them starting. So I said, okay, so I did that for seven years. I had a running account with Bonnie Adams at Lewiston Travel, you know, and I'd say, I'd call up Bonnie, I'd say, okay, Tuesday morning at 6:30 out of Portland to Charlotte, North Carolina, and a rental car at the airport. Fine, so, there's a corporate discount and the whole bit. So I traveled for seven years, and the agreement was also for my wife to come with me. So, and when we were down there and we'd see these old big Southern houses, you know, with these big columns and the whole bit, two stories and the real thing. This is where we lived while we were down there. We had a chef in the kitchen, we had maids, we had cleaning people."
"AL:","So you enjoyed those seven years, I take it?"
"RD:","Well, when I think about it, I says, you know, why didn't I think of this about twenty five years before this, you know. Well, yeah. And people would say, god, you're always traveling and you've got your briefcase and, you know, you're going here and you're going there. And I says, yeah, but keep in mind, it's a little bit stressful because you've always got a time, you've got to be at a certain place at a certain time to meet with people to discuss, you know, projects and so forth, and I says, you know, it's, it's an excellent way of life but there's a little bit of stress. But I says, no, I like it, you know. Like my wife would say, oh, you're having a good time, and I'd say, sure am. And we'd schedule it so we'd go down there on a Tuesday, and we'd stay over the weekend and come back the following Wednesday, so on the weekend we had the rental car. The older brother had a big condominium in Nashville, in North Carolina, in the mountain area of western of North Carolina, there was, it could sleep ten people. It was right on top of a mountain. And the keys were always there, and he says, you know, if you want to go spend a weekend up there, there's the keys, go on up. And he said, make a call first to the caretaker, we'll make sure everything is in order. So, he says, the only thing is, he says, you'll have to scrounge for food on your own. I said, well, that's hard to do. So that's, or we'd hang around and we'd visit Charlotte, which was a real money city. I mean, when you talk about Charlotte today, where all the credit cards and everything else is processed in the world today, it's either in Charlotte or in Atlanta, Georgia, you know, so. We used to drive down, because this was right on Rte. 85 going directly to Atlanta, Georgia, we were about a quarter of a mile from the Interstate, where the plant was and where we were staying at the house, and we'd get on the Interstate, drive directly to Atlanta, and visit, you know, Peachtree and everything else in Atlanta, got a motel, hotels in Atlanta, and that was all part of the deal."
"AL:","So how long did the Chinese brothers stay involved with the mill, until what, or what happened when they left?"
"RD:","Everything fell apart. This is when Fred Lebel, you know Fred? Fred was the plant manager at the Bates division. He was about the only surviving one left at the time. He acquired financing, or 8 backing, to acquire Bates Fabrics at the time, but he just didn't have enough capital to keep it going. And I think he was, he was really on the wall there, and I think this is about the time Emile (name), the investor, financial investor, came in and took over. They went into, they created Maine Heritage Weavers, because when the Chinese acquired Bates, they acquired the name Bates Fabrics, they paid $2 million just for the name of Bates Fabrics. And the minute they acquired that, they could shut everything down and go to some other part of the world and set up a little plant, which was Bates Fabrics. And while I was the consultant for those seven years, I can remember the MInnette-Bates Corporation, I was the corporation. So if, you know, if anybody tried to sue me for any breach or anything, they had to sue the corporation so I was covered for any suit or anything. Because on my business card it said, you know, Minnette-Bates, but way down on the bottom it says, Minnette-Bates, Inc., and that was my, I was the corporation. But the controlling, the two Chinese, their controlling corporation was Chauncey Corporation, which came out of Hong Kong, this is where the money was moved back and forth. But, I don't know if it was the younger one that was blowing the money and it just wasn't going in the right direction, I think, in the end. Because I think it was two years after I finally retired, because I figured I was going, when I retired here at Bates, in the Bates division, I had forty-three years of time in. So I kept thinking, well, if I go about seven years as a consultant, I'll have exactly fifty years and then I'll be ready. So the two Chinese brothers, the older one kept, he was never really around, he'd probably come in once a month for, sometimes it would be a week, sometimes two or three days. Because, he'd call me up, when I was here in Lewiston or down in North Carolina, he'd call me up and say, Ray, he said, how about this, think about this, he says, can I do this? And I'd think about it, and I said, well, if I couldn't give him an answer, I'd say, well, I'll call you back, I said, where are you right now? He says, I'm in Hong Kong. So I said, okay, give me about an hour and you call me back, because I'm not going through your system over there, it takes too long. He says, okay, and I'll call you back in an hour. So that's the way it was. Other times he'd call me and I say, where are you now? I'm in Jamaica. He had a setup in Jamaica, at the Kingston Inn in Jamaica, he said, I'm in Jamaica, he says, I've got a whole bunch of looms here I'm thinking of getting started, he said, (unintelligible word) some thought of this project? And I said, yeah, I said, it won't work. How come? And I'd explain it to him, and he'd say, oh yeah, I never thought of that. Okay, forget it. Goodbye, you know, and be gone. Next time I know, I'd be in North Carolina, he comes walking through the door. How you doing? You know, it was like that. Like I say, every day was different, whether it was here or down in North Carolina. And if I was in North Carolina, Baxter Corporation was his supplier for textiles, for any kind, the thread, cards, or computer things, they were the supplier to the textile industry and they were located in New Jersey, and one in Shelby, North Carolina. So every so often, if they knew I was down there they'd give me a call and say, would you come down to our plant, we got a question we'd like to run over. So I'd say, okay, I'll drive down, say, tomorrow morning. Okay. So I'd drive down there and we'd go to the executive board room and sit there for hours, and they'd order food in and, they'd say, well, it's about lunch time, we'll order a meal in, you ready to eat? I says, why not, you know. So we'd walk around and, of course these places here, you know, you really weren't supposed to be in there because everything's supposed to be top secret of what they're making so your competition wouldn't find out. But they brought me in, you know, I could pick up anything I wanted to and they knew that, you know, I was up front honest with them for everything. Whether I liked it or not, I told them what I thought. Either I didn't like it, I'd say yes or no, you know. They'd say, well, we're thinking of doing this. I'd say, no, it's no good, it won't work. You know, you might get a good sample or a good starting thing, but it just won't work in the long run, on a production basis, I said, I don't care what you do. Okay. Well, 9 how about a different idea? I says, well, okay, I'll work on that. So, I mean, that's - End of Side A Side B"
"AL:","We are now on Side B. I'm sorry, I interrupted you."
"RD:","Okay. So, how much time do you need?"
"AL:","Well, let me think about -"
"RD:","You got any more?"
"AL:","I guess one of the questions that I wanted to ask you was to go back a little bit about the people who work in all the different areas in the mill and how they interacted. I know you talked that you worked directly with the loom, the weavers."
"RD:","The weaving room, yeah."
"AL:","What sorts of different jobs were there in the mill?"
"RD:","Well, of course we were almost self contained as far as, in other words, the cotton would come in from the cotton fields in bales, it would start right from that point to make the yarns for the woven goods. So we processed all the way through, from the cotton ball itself coming out of the bale, it was, you know, processed, different machines all the way through until it was a fine thread for weaving. So we, and then after, say, the bedspread was woven, it was either preshrunk if it was going to be a natural color bedspread, or if it was going to be dyed, we had our own dying in the lower area of the Bates complex, we had giant vats to dye any color you could think of. We had, like Gerry Lafrance, who was a chemist in the lab, to give you the right color for any shade you wanted. So anything that you needed, we had. As far as maintenance, we had an electrical shop, we had a carpenter shop, we had a machine shop, we had a plumbing shop. You name it, they could make it. If anything broke down, they could make it within a certain period of time, unless it was a special piece of machinery on a certain part of the loom that was a trademark. Then you couldn't really make it to fit, it had to be the trademark piece to go back. But anything else, they could make right in the plant. So we were self-sufficient. And finishing the bedspreads, packaging bedspreads, you know, until they were all completed and going out the door to be shipped to the customer, everything was done. Our office, we had all the accounting people, the business people, we had the New York office. At the time the main office, we owned the building, it was at 80 Worth Street. We had, you know, I don't know how many salesmen at one time, probably anywheres from forty to fifty, all over the United States. So from beginning to end, we were self-contained as a corporation."
"AL:","Did people work shifts? Was the mill going all the time?"
"RD:","We ran three shifts in the good years, yeah. We had from seven to three, three to eleven, then eleven to seven. Yeah, just like that."
"AL:","Now, in your department, design, they didn't work shift work there, did you?"
"RD:","We were in from eight to five. Then later on we went from seven to four, or seven to three thirty, and we went out for a lunch break. Most of them, they took a half an hour, to cut down their time. So we went from seven, say, seven to twelve, then twelve to one we took a lunch break, and then we came back 10 from one to three-thirty or four. But on some periods when we were overloaded with design work, we worked a lot of overtime. I saw spells where I'd go in at seven in the morning, and stay there until five, come home for about an hour, and go back about seven until midnight."
"AL:","Now, did you get paid extra, or were you salaried?"
"RD:","Oh yeah, oh yeah, this was big money, yeah."
"AL:","And so, it was probably, I'm thinking in terms of lifestyle, the people who worked shifts had a little, were a little bit different in terms of how they worked than, say, you, where you were pretty much during the day. Did you interact at all with the people who worked -?"
"RD:","Well, see, like, on my level, going back from day one, I kind of, when I walked in, I walked in on a management level as far as you look at it, and not, say, on the union. Because I never had anything to do with the union, and of course, say, starting with the weaving and all the other departments, everything was union. But, say, the main office, all the office accountants and everybody else, that was strictly the management area. So that way there, maybe I was fortunate when I walked in, from day one, I walked in on a management level. So, and that's the way it worked out. But the union, over the years, they were good, you know, they weren't like some of the unions you see with the auto manufacturing and so forth that get out of hand. This local union was, they did well with the people."
"AL:","Did they, were there issues that came up over the years that you can recall, that the union got involved in? Hours, or working conditions, or pay?"
"RD:","Well, it was the usual thing. There'll come a period of time where people got a little antsy, the price of things will start going up and the people will say, well, it's time for a raise. Well then you, the contract, over the years, averaged on a three-year level, the contract would run for about three years. And then the people going into, beginning of the third years would say, okay, everything's going up, we need a raise, you know. I really never saw a strike or a shut down for, I don't know, like any more than, that I can really remember, of a week really over the years. Or anything serious, like you know, things nasty like breaking things or, you know, hurting people. It never happened. People had their opinions, but they always, they all went to the union meetings, and this is where they vented all their displeasures and so forth. It was, it was fine over the years. I really can't remember any event that, you know, was serious enough to, you know, like you'd call the police in to squash something. I can't ever remember anything like that."
"AL:","Do you have recollections of Hal Gosselin?"
"RD:","Hal Gosselin, yes?"
"AL:","He was president, or vice president of Bates at one time."
"RD:","He was assistant to the president. That's, in the beginning he was, in the beginning, if I remember right, he came in to publish a magazine. He was in charge of publishing the magazines and the yearly annual reports and things like that, so he was involved in the printing of the magazine and so forth. 11 And of course, we changed presidents over the years quite a few times, you know. And he, at one point there, he went from that position to assistant to the president, and if I remember right he stayed at that level until he, I don't know if he retired or moved on to, he moved on to CMMC. But I think he was just assistant to the president when he moved to that area. He went to CMMC as, I think it was public relations director, when he moved to that area. I remember (unintelligible phrase) a few contacts with Hal where we discussed some of the things in the magazines he put together for, like the spring line and the fall line and things like that. You know, I think it ought to go this way. I says, no, no, no, this."
"AL:","Artistic disagreements?"
"RD:","Yeah, just you know, business disagreements."
"AL:","So you said there were quite a few Bates presidents over time at the mill. Are there any that really stick out in your mind as being impressive, or not so?"
"RD:","Yeah, there was one way back in time, Herm Ruhm, Ruhm. He was a good, he was a family man and he was honest, you know. And we had some, one of them was Arnold Ginsberg. He was a character. He'd show up probably every two or three weeks, and he'd walk in, come through the door, and here I am, my name is Arnold Ginsberg, I'm president. I says, yeah, Arnold, this is what you said when you said when you were here last week, I says, don't you remember? Oh yeah, yeah, yeah, okay, you know. Flighty, you know? But there was - (Outside interruption.)"
"RD:","My wife was a nurse until she retired, and she said, I want to do something different, so she went to work at Porteous, you know, selling the kitchen ware. And of course, if you look around you'll see all these quilted things are hanging all over the place? This is her hobby, so she's got her workshop back there. I still got my office way back in the beginning because I still do a few things on the side, so."
"AL:","But were there any other Bates presidents that you recall, or are those the ones that really stick out?"
"RD:","Bill Hickock, he was interesting. There was Thomas Levine, he lives in Manchester. He was probably towards the end of, just before, yeah, he was just before the Tangs came in to buy out the Bates Fabrics. But way back in time, God, there were so many I just can't."
"AL:","That's okay."
