"person","text"
"(Interviewer:","Andrea L'Hommedieu) April 8, 2005 Andrea L'Hommedieu: This is an interview with Ray D'Amour at his home at 64 Lowell Street in Lewiston, on April 8, the year 2005. This is an interview for the Mill Workers Oral History Project, and this is Andrea L'Hommedieu. Could you start just by giving me your full name and spelling it? Ray D'Amour: Okay, it's Raymond, first name, G, which stands for Gerard, D'Amour, D-apostrophe- capital A-M-O-U-R."
"AL:","And where and when were you born?"
"RD:","I was born in Lewiston, at St. Mary's Hospital."
"AL:","And the date?"
"RD:","January 20th, 1925, which means eighty years old."
"AL:","And did you grow up in Lewiston?"
"RD:","Yeah, I did, yes. Lewiston and a few years we moved to Auburn. My folks had bought an apartment building, and we lived there. Fact is, I lived there until I got married, which was back in 1951."
"AL:","And so, were your parents both from Lewiston as well?"
"RD:","No, my mother was born in Canada, at Saint-Hyacinthe, and my father was born way up beyond the St. Lawrence in a little town by the name of Matane, M-A-T-A-N-E, I guess he always spells it. But when he came to the United States, like all the French Canadians at one point, he was naturalized and became an American citizen. I don't know if it was soon after he got here, but that's the way it worked out."
"AL:","Well, what brought your parents to Lewiston?"
"RD:","Well, like everybody else at that time, people were coming here to work because, you know, in Canada the farms, the farmers were really getting nothing and they were more or less starving, and so I suppose the recruiters for the businesses in this area here were up there looking around to see who wanted to come to the United States and work. So that's, probably that's the way it worked out."
"AL:","Did your parents work in the mills?"
"RD:","No. That's the funny part of it, no. Fact is, my mother never worked. But my father was in the shoe industry all his life, so that's the way it worked out."
"AL:","And what were their names?"
"RD:","My father was Charles, Charles Phillippe, and my mother was, real French, Antoinette, I don't 1 know what her full name, but her family name was Robitaille, so that was, that's the way they came to the United States at that point. But my mother was never naturalized. She had a permanent, I don't know if a permanent visa for visiting, or for staying, but anyhow, it never came about. So, that's the way it is."
"AL:","Now, if you were born in 1925, you were a teenager at the time the Depression hit."
"RD:","In 1929, yeah."
"AL:","Do you have recollections of that time?"
"RD:","I sure do. It was unbelievable to think this now. You, you know, you almost fought for a penny, or two pennies in order to, for what you thought you might work for or, you know, any little job, anything, because there was no work and things were hard. It was unbelievable. But, people in the United States survived, you know. It was like the wars we have, we go and we come back and we move on. But it was a rough period. Seems though it dragged on until I would say the mid forties, 1930s. It was a rough time."
"AL:","How did it affect your family?"
"RD:","Well, my father had built the home we were living in, and he built it as he had the money, so there was no debt, there was no mortgage to it. So we owned a home, and we had large gardens, because we had quite a lot of land, so we had a lot of gardens. So, you know, as far as food and vegetables and things like that, we had our own supply. And the neighborhood (unintelligible word) further up on Main Street, the neighbors were all real nice, and those that did kind of shared with those that didn't. So it was a happy time, when you think about it, also because of people getting together and sharing things. It was, when you look back on it, you know, there was pleasant memories. It's not like you were living in some place and everybody was against you. So, that was in that period of time."
"AL:","Now, did you go straight from high school to work in the mills, or how did that come about?"
"RD:","My junior year in high school, I was drafted, and I was in the service for three years, I was down in the South Pacific for three years. And going back in time, from the time I can remember, I could pick up a pencil or a pen and I could draw anything I could think of, you know, I just put it on, you know, on a piece of wood and, burn it into the wood, or do anything. So while I was in the service, I did some artwork for the military newspapers, you know, and when I got out of the service, one of our neighbors right across the street was one of the top executives at Bates. And he said, you know, I always see you with a pen or a pencil and you seem to be able to draw anything that you think of, he said, would you think of considering of going to the Bates to draw the designs for bedspreads and draperies? I said, well, I never gave it a thought, you know, because at that time I was just getting out of the service and I had nothing in mind. So I said, I don't know, so I said I'd think about it. So he kept, every time he'd come across the street to visit he'd talk about it, and he says, have you thought about it? I said, well, I'm giving it some thought. He said, okay, he said, if you want I'll make an appointment with you with the plant manager at the Bates division where the bedspreads were made, and he says, you go. And at the time, the plant manager was John Collins, John Collins."
"AL:","And who was the person who lived near you?"
"RD:","Fritz Newton. He was the head and the chief engineer for the whole mill complex. So he made an appointment, I went to see the plant manager, and of course when you have somebody that's giving you 2 a little bit of help, kind of nudging you, it makes a difference also. So he said, well, how about coming back and, say, next week some time, and bring some of your artwork, you know, whatever it is you want. So I went back the following week and they looked at it, and he said, well, I'll bring you out to the head of the, the director of designing right now, which was George Mills, and he said, let him take a look at it and you talk with him, and he said, he's expecting you. So I went out and sat down with him and he said, yeah, he says, fact is, we have an opening right now because one of the older veteran designer has just died a couple weeks ago. And I mean, they were super designers, because they, they two head designers were German, and I mean they were real high tech. So it was a great area to go into, because there was one of them left, of the two brothers. So I said, he said, if you want to come in, he said, we look at all your art work and everything, he says, you know, in your case it would be better to start hands-on, the actual experience, than trying to go to some design school or something to get it from a book, they said, here you're going to get the actual so, he said, what do you want to do? So I said, I don't know, I'll give it a thought. So I went back to I guess the plant manager and he said, well, what do you think? I said, well, I'm interested. So he said, when do you want to start? And I said, well, let's put it this way: this is the last part of October, I've been away for three years and I'd like to go hunting for the whole month of November. So he said, well, that's no problem, so we'll see, I'll see you the first week of December. This was back in 1946, and the first week in December I showed up and I started. And I just kind of fell right into it, you know."
"AL:","So you worked very closely with the remaining German designer?"
"RD:","Yeah."
"AL:","And who, what was his name?"
"RD:","(Name) Lehman. And he was as efficient in high tech as his brother was. The older one was Arthur. And, you know, if you made a mistake you backed up and you corrected it, you didn't let it slide. I mean that, because when you're designing something, everything has to be on a graph because everything has to work out well on the loom. There's no room for mistakes, because the one mistake that you make will be one mistake on the loom, which will be one bedspread they'll have to throw away. So, I learned from, you know, Dave wanted to, you don't make, if you do make a mistake you come back and you correct it. Or you ask, you know, what's the right way to correct this. And it, when I look back on it, I couldn't have found a better life, you know? I mean, it wasn't hard work, you just sit there and you put your ideas on paper."
"AL:","So you got to create your own ideas for designs, or did it always go through the other one?"
"RD:","Well, the way it was way back in time, Bates was number one in the country, or in the world as far as making bedspreads at the time, and all these companies were coming, like J. C. Penney, Sears, whatever, back in there, they would come to us, not their sales people but their marketing people, and they'd come to us and they'd say, you know, the trend this fall or this spring is going to be with this type of flower, or this type of motif or so forth, can you give us a bedspread with this type of idea. So whoever spoke with these people at the time made out a sketch if they were, you know, really interested, and you'd say, how about something like this? And they'd look at it and say, well, yeah, yeah. Maybe a little bit of this, a little bit of that here and there. So before they left you had a working idea for a commitment to them. 3 So you put this on point paper, graph paper, and you painted it out and you show, you know, sort of a working design, and then when you get everything processed for the cards for the loom, for the weaving, you send it out and a sample weaver wove one bedspread as a trial to see, to look at and see what you had. And if everything looked all right you shipped that to the customer, and they looked at it, and most of the time we'd get a call a couple days later saying, yeah, go ahead with this. And you got so many sizes of this color, and so many sizes of that color and so forth, so we used to run twins, doubles, queens and kings, so, you know, they'd say, well, we'll start off with fifty thousand units, or a hundred thousand units. So you get together with the accounting people in the main office and the people who organized for production so you could set up for many thousand units, and this is what you're going to, here's your design and your pattern, and go ahead. And this would be, say, for J. C. Penney's or Sears, or whoever else the account was. So that's the way it worked."
"AL:","Were there other departments within the mill that you worked really closely with?"
"RD:","Well, yeah, the weaving department, yeah. And we always had our own sample weaver. In other words, he was probably the best weaver around, that we acquired just for this purpose, and that's all he did, just weave our ideas."
"AL:","Oh, and then you could really see it, and then know whether it was something you wanted to go with."
"RD:","We'd tell him, you know, just weave a little strip of this so we can see just this area, and bring the piece in so we can take a look at it. That's the way it worked out, so this weaver, or this person, whoever was doing it, that's all that he was doing. So, if he had to weave just a little strip, say, first thing in the morning, and we didn't need anything else the rest of that day, he could sit down. Sometimes we'd kind of lure him out to the weaving area in case they needed some help, but that's the way it was set up. There was a lot of people around to do even minor things in that period of time. It wasn't like today, you know, everything with a skeleton crew and, you know, this person has to do fifteen other things while he's doing this. Each person had their own speciality, really. And over the years, just the design area, we had a staff of about twelve, we used to have about twelve people. In other words, we had the design core of, say, the artists or the designers as such, and we usually averaged, oh, between four and six designers at any given time. And they were both male or female, so there was no discrimination, even back then. I remember, in the summer time over the years we'd have students come in that were interested in designing. And one of the students that came in quite a few summers, Elaine Libby from Libby Mills, she would come in, we'd get a call by the time her spring college session would be coming to a close, and she'd say, can I come for the summer? Oh sure, come on in. Fact is, that's the way I got in contact with the Libby complex over the years, and did a lot of freelance work for the Libby Mills."
"AL:","Were they in competition with the Bates Mill at all, or was it just very different?"
"RD:","No, because when you think about it, the Bates fabrics people, we were weaving cotton, we were in the cotton field, for cotton bedspreads and cotton draperies and anything else. Libby Mills across the street was in the woollen area, so there was no, and most of their patterns and designs was aimed at the Indian motifs and that kind of, and gradually we kind of worked it into plaids later on. We thought, well, it's time to face away from, you know, let's get with it, and we got them to go into the plaid area, which they did extremely well after that. One of the things with the Libby Mills was that the week before they were going to start up a whole series of brand new looms they had bought to weave this type of plaids, which were still in the 4 woollen area, we had just completed a whole series of designs for them. And that's when they had that big fire over there, and it burned all the new looms and everything that had just been set up. So that was the kind of downfall of Libby's, you know, they couldn't come back after that. But that was excellent, too, you know, freelancing with the Libby, because Bates was aware of this because, you know, it was kind of a neighborly thing because there was no competition. And they just said, you know, this is your free time, you can do what you want with it. So that's, and of course when you freelance the money's real good."
"AL:","Now, in your department were there mostly Franco-Americans, or was there ethnic diversity within the design area?"
"RD:","Well, you take like Bill and Arthur Lehman, they were German, they were pure German, yeah, they were from German originally, they were born both in Germany. Herbert Hecker, he was, you know, I don't know exactly what the nationality was there. And we had Canadians, we had, or course Libby was, I don't know if she was Irish or English. And then we had George Mills and Harold Mills."
"AL:","Yankees?"
"RD:","Yeah, so there was, and we had one or two Italian people at one time. So it was, you know, it wasn't exactly one nationality. So it was, it was a mixture of such."
"AL:","Do you know, did different ethnic groups tend to be in different, certain areas of the mill, or were they, that you recall?"
"RD:","No, it's funny, the thinking wasn't like that. It was a case of, this is your qualifications, you are well suited to do this type of job, and that was it. So it wasn't, you know, you get a whole bunch of Irish people over here and a whole French Canadians over here, it didn't work out that way. No, it was, everybody kind of worked together. Of course, like any other place, you always get one or two people that mix up everything for everybody else, but it was like everywheres else, you know. Over a period of time you kind of keep an eye on him, first thing you know it comes an opportunity, so, here's your severance pay."
"AL:","Were there social activities connected to the mills that people who worked there got involved in?"
"RD:","Okay, one of the things, hockey. Bates had a championship, world championship hockey team way back in time. Rachel's got some photos there at the museum you can check on. We had bowling leagues, we had softball leagues, we had baseball leagues, we had camping trips, you know. We had our own newspaper; it was published, I think most of the time it was on a weekly basis. And we had monthly magazines, and we had trade magazines that we put out, I think it was like a cycle, the spring, midsummer and the fall, and so."
"AL:","Oh, wow, did you belong to any of those?"
"RD:","I belonged to the bowling league. Fact is, I had started when the big ball bowling alleys came, first came, I had made contact with them and we started a bowling league right there and then. And then it kind of built up and had different divisions or the Bates complex, you know, like the Bates division, the Hill division, the Androscoggin and the Edwards division, and we kind of (unintelligible phrase) have our own inter leagues."
"AL:","So you got to know people who you didn't necessarily work closely with every day, in another, by being on those teams. 5"
"RD:","That's right, yeah, you got to meet people from all the areas of the same complex, you know, the same, so. But, no, like I say, it was a great life."
"AL:","Did it feel like more than just a job? Or how, did it feel like a community in some ways?"
"RD:","Yeah, it did, yeah. I wasn't like you said, well, now I got to go to work today, you know, you said, you got up in the morning, hey, I'm ready to go, let's, what's going to happen today. And in my case every day was different. You know, you walk in and somebody would say, you know, you got a message here, this customer or this, you gave him an idea or you sent him an idea last year, or last week, and they, you know, they're interested. Can you elaborate a little more on this idea. So, you'd see down and look to see if we had anything going. If we had a design or a project going that we needed to expedite, well then that had to be out of the way, and then I'd come back. Every day was different. Get a call from the New York office and say, hey, they're going to send somebody down there and they want to talk to you, because, you know, you spoke to them over the phone or something a couple weeks ago, or something. So it was always like that."
"AL:","And you stayed until 19-?"
