"person","text"
"RD:","But it seems as though every, come the first of the year we'd get a memo saying, well, the old president is either going to someplace else or he's retiring and we're going to have a new president in a couple of weeks. So, this is the way it was. But, you know, a president is like, okay, they come in, they go, you know, it doesn't change anything, everything keeps moving. Unless you get one that's coming in who's got stupid ideas, you know. Like, well when the Tangs came in, the ongoing, Eric, he had all kinds of, you know, well we're going to modernize this this way, and I says, you know, you're not thinking of the people, Eric, I says, you're thinking of the machine. You got to think of the people. This machine is not going to work until these people press the button and tell it what to do. Oh yeah, but that's simple. I said, no Eric, it's not simple. You're not considering the product that you're going to put, use this machine for, I says, it's just 12 not going to work. Oh, wait and see. Well, they'd bring the machine in and set it up, it would take three or four weeks. Even the people who set it up couldn't get it to coordinate with what was supposed to be, the duty it was supposed to be doing. And I'd walk down and take a look at it, and I'd sit back and laugh. And Eric would show up and he'd say, what do you think of that thing? I says, yeah, come on down, let's go take a look at it. And I'd stand there and say, what do you think? Well, stand here and watch, they're trying to get it to go. I says, can you go over there and get this thing going? Well no, he says, I'm not up on this high tech stuff. I says, why the hell did you get it? Well, somebody sold me on the idea. I says, yeah, all right, you spent seventy five thousand dollars setting this thing up, and you're paying it on a lease basis, on a monthly basis and now you probably paid a couple of months, which I didn't think he did, but anyhow, I said, and it's not even running yet and it's not going to run. So, well, he says, maybe you're right, he said, we'll give it another month. Well, within two weeks the people who brought it in came and took it out, and they went back to the. But, you know, he was like that over the years, but you know. Like Bill Hickock, in his spare time his hobby was woodwork, to make woodwork, you know, outdoor chairs for lawn furniture and things like that. And he lived in upper New York state, and he has his own workshop and everything. And every time he'd come to the plant he'd say to us, can you draw me an idea for this type of chair, or this type of cabinet. So I says, hey, we're making bedspreads here, not furniture. Well, he says, you know, this is for my little project. Okay, so, we'd kind of scribble (unintelligible word), hey, yeah, he says, could you detail it a little bit so, you know, to show me the parts. So I says, yeah, I think so, I says, next time you come we'll give you a, like a blueprint of some time. Because we could do blueprints, too, because I had taken mechanical designing and blueprinting and the whole bit, so there was no problem. Fact is, our design department, we could do anything. The artists in there could paint, you know, they could pick up, you'd come in and they could just look at you and paint a portrait, sketch it out within half an hour and then go home and make a painting and come back next week. I had one guy, Larry Stevens, he was unbelievable, he could paint the best portraits. That's the type of people we had."
"AL:","Are there things that I haven't asked you about, about your time at the mills, that you think is really important to add today?"
"RD:","Okay, okay, let's go back a little bit. Over the years, the Bates, it was Bates Manufacturing was back in time, that's the way it was incorporated, Bates Manufacturing Company, Inc., I think, is the way it was way back in time. We had the Androscoggin division, which was where Marden's has their storehouse way down at the end of Lisbon Street. And then we had the Hill division. The Androscoggin was where the main offices used to be, way back in time, and then they were brought back to the Bates division later on. The Hill division was weaving mostly sheetings, sheet goods, and I think at one time they wove shirting material. Way back in time they used to have these striped shirts which was a big trend, way back in time, in the '30s, '40s and that period. And of course the Bates division wove bedspreads, but way back in time they wove rayon bedspreads, then later on we went to the nylon, dacrons as far as yarns, and then we wove table covers with napkins. I don't know if you remember seeing them, that was way back in time, the nice shiny table covers that we used to weave with napkins and the whole bit as a set. 13 Then later on we got together with Guilford Mills out of, was it Dexter? This is the period of time when the office complex, in other words they put up an office building and it was wide open, and instead of having all kinds of office divisions, they came up with the idea of walls in between each area. You know, in other words, you have this area here, and we're going to put up a wall here. But it wasn't a full wall, it was just, say, a panel. And all these panels on both sides needed something to give it some color, so we wove what we called paneling material. It was woven by the yard, and we put all kinds of designs on it. And this was cemented to these panels for divisions in big office complexes. Like, you know, if you see a commercial today you see these, all these little cubbyholes? Well, most of them these days, they don't, they're all plain, you know, they have it shabby looking. Well, what we did is all kinds of designs on each one of these panels, so you had an office, you could have one panel like this with one design over here, one over here, and so forth, if the manager wanted to pay for this kind of paneling. And then about the same period of time, we worked with this company, or this, people out of New York that they were in that same field, and that they were making this type of, for whole walls, you know, and we did a lot of that. We used to, for them we'd take a warp beam, you know, with all, that you've seen probably with the yarn that's laid on, so we could set it up on the back of the loom for the warp yarn. Well, we did multi colors. We put it all on there and we'd run it through, and we had a design that when the colors were dyed onto this wall, it was still just yarn but it was dyed onto this wall, it gives you all kinds of designs. And then when they put the warp on the back of the loom, when it came through for weaving, you see, you had that design on the warp itself besides the other pattern that you put on it. So you had a multiple idea of shades on the warp itself, and then the design that you put on the face, you say the face of it. Well, we had a monstrous order, just about the time the mill kind of folded, with this company out in New York. You know, we're talking millions, almost billions of dollars in contract. We just couldn't turn it over, you know, the money there for, the capital for doing this just didn't work out. And like I say, the last manager there was Tom Levine out of, who lives, he used to be, with his father, a Carlton Mills, you know, when you go through Winthrop, the Carlton Mills, he was there with his father, they owned that. Then when they closed down, he came to, with us. But he was the last until the Tangs took over."
"AL:","Is that a good place to stop today?"
"RD:","Yeah."
"AL:","Okay, thank you so much for your time."
