"person","text"
"VG:","Yeah, flat to standing. It's a little rig that they take and it's got all kinds of little pallets here and you go to the next pile- so now the sides are dry and then they wheel them off and stack them. But if they had a downpour or if it rained all afternoon after they laid their brick out on the field and during the night, the next day they had to pick all that up, because that field had to be kept clean for the next day's work, so they'd bring the brick here and lay it down here- and I think they have two, one for drying and then they'd use another part of the field."
"AL:","Well, what did they do with all the bricks that got ruined? Did you just make a big pile?"
"VG:","They're just back in the pit, I guess. I don't know what they did with those bricks. It's the same with bricks after they've been cooked and everything. These brickyards had mountains of brick that were either broken or not perfect, not good enough to sell. Then they found out that they could put them in a chipper and crush them and make that stuff for lawns around the bushes and stuff, like mulch. So now these brickyards had mountains of these bad bricks, so they got those machines and they crunched them - what was junk that had been laying there in piles for years. Then they sold them as - not mulch, but -"
"AL:","I know what you're saying. I can't think of the word either."
"VG:","Yeah, it's red . It was crushed brick anyway. And then they had the white stones or they had mulch for around the bushes."
"AL:","Well that's a good way to re-use."
"VG:","Because those bricks would have been just- they'd still be there. And it's like sawdust now. You don't see any more sawdust piles. There used to be sawdust piles half as big as this mill all over the place. I remember a lot of them. They'd be out in the back forty or something. They used to set up these sawmills all over the place and they'd -ten, fifteen years, maybe twenty years, there'd be a sawmill there, there'd be mountains of sawdust. You don't see any more sawdust piles around. It's all used, which is- see, that's another thing, there were slads (sounds like) all over, because I told you before there were sawmills all over the place so we could get slads, you know, 10 without hauling the stuff a ridiculous amount of miles to get to the brickyard. So now there are no more slads, and I still say it would pay to open up a small brickyard and make that brick. Because you look at brick, and you can tell a water-struck brick by its nice little round design, almost the length of the brick. And you've got seven or eight different colors in that brick. That's a water-struck brick. It goes from black to brown to hues to pink, red, bluish, and you see that little ring - it's about almost the whole width of the brick and different colors as they go into the middle. You watch on buildings and you'll see."
"AL:","I'll have to start looking."
"VG:","That's water-struck. When they're all nice and plain and all one color, that's usually wire-cut, what they call wire-cut. That's all done on a machine. But it's still wheeled around by hand and stacked up in sheds until it dries enough to burn it."
"AL:","Are there other people that you know that would be good to interview about brick making?"
"VG:","Have you interviewed Harvey?"
"AL:","We've interviewed Harvey, yes."
"VG:","Henry Berube?"
"AL:","I don't know. I'll have to look on my list."
"VG:","Henry would be good. Giguere passed away. The Chamberlains passed away. Foley passed away. Oh my god, they're all dead. Henry Berube - I worked with Henry, so I'd say him. And I have no idea where the rest of them could have disappeared to. Of course, I moved out of the community for a long time so I haven't been in contact with a lot of those people."
"AL:","Well, I thought I'd ask because our list is pretty short and we're just trying to find more people who did that kind of work."
"VG:","Well, Henry might - I think he spends his winters in Florida. I don't think you'd be able to locate him. But the one to find out from would be Harvey. Harvey's got a fantastic memory. He remembers everybody. If the guy made brick, Harvey knows him. So you have Harvey make a list - you can 't see - you 'll have to talk to him."
"AL:","Is there anything that I haven't asked you about, about brick making, that you think is important for us to add?"
"VG:","Not really. 11"
"AL:","All right. Well then thank you very much."
"VG:","You're quite welcome."
