"person","text"
"RG:","Well, a reporter, it was, that was for the mill, you know, so it was people working in my department. Let's say when one of the ladies had, were going to Florida for the, for two weeks, she'd come back and she'd say well we saw this, we saw that. And that's how I come, and of course I traveled, too, and when I traveled I used to come back and say where I've been and what I've done. And if somebody bought a new home, they'd talk about it so I'd write about the new home, you know. They'd say, well I worked hard enough, I made, I got the money, I'm buying myself a home. They used to live on rent on Lincoln Street, on Knox Street, on Bates Street, and now they were buying homes out of town, you know, on the outskirt, not out of town, on the outskirt of town and I used to write about that. If they, if there was a wedding and they wanted to talk about it, I'd write it down. I'd say, (rustle of paper), I'm taking a few things out, you know. That's the (unintelligible phrase). One of the highlights, when Maurice Chevalier came to Lewiston, I was working for theater so they asked me to work, so I was the head man at the Armory for the set up and the lights for Maurice Chevalier. And I, of course I talked to Maurice Chevalier and he -"
"AL:","Oh, an autograph."
"RG:","He gave me his autograph. And Bates had given him a floral to-do, they had put it in his room, the backstage room where he was, and he gave it to me to bring it to my mother. See, this is a letter, the instruction they had given me for Maurice Chevalier, what was to be done and the directions of the lights and - End of Side A Side B"
"AL:","We are now on Side B."
"RG:","Okay, he was, they were saying how they wanted it and all that. So he, I (unintelligible phrase) Maurice Chevalier, and of course when I said, I talked to him, How come you speak French? I said, eh, I'm bilingual and I've tried to be all my life, you know, to try both language. And he said, you come from France? No. You come from Canada? No, I says, I was born in Lewiston, I was born in Augusta but, I says, I speak French and I've always been favoring French. And so before I left he said, well, bring that to your mother, amen soit a ta mere, and I still have the dish that had presentiment floral arrangement that they had given him as a welcome in the office, you know. And this is Maurice Chevalier, and there's an article about me for the news, and I was honored as a newspaper, as a reporter for Bates, I was awarded an award for that for Bates."
"AL:","And so it was called The Bates Spinner?"
"RG:","Yes, that's what it was called. And, you know, there was a report from each department, and we used to relate our department. And I remember saying about the Christmas party, remember I told you we were having Christmas party and I wrote it down, in the mill. About a hundred people came to see me and say, How come we don't have party in our, well I says, get organized and get your own party. I can't go and do parties for every department, I says, I have a hard time doing the parties for my own. Yeah, and you see, Bates news."
"AL:","When you were in your roll as a union person, do you recall some of the issues that came up between the workers and the company, at the company? 8"
"RG:","Oh yeah, well first of all the wages. If it wouldn't have been for the union, we would never, never had increase in wages. We're the ones that were negotiating each contract, how much money we would put in towards wages and toward our insurance, and benefits like holidays. I remember when we first got started working for the union, we only had four holidays paid by the company. And by the end of their closing, we had eleven holidays paid, and we had a week's vacation paid. We never had that before the union came. Before the union came we didn't vacation pay, and after the union we had a one week vacation paid. These are some of the things. And of course, I mean, different department jobs, involvement in different, they were always increasing, they were always feeding the machines, and we had to fight for, to keep them at a certain level so that people could get along, could do their work. Because if they were, it's feeding too much, they couldn't do their work. They couldn't be able to -"
"AL:","Did you have any, would you be somebody that workers might go to if they were injured on the job?"
"RG:","Oh yes, oh yes, oh yes."
"AL:","Were there some injuries that were more common than others?"
"RG:","We were, we had a nurse, we had a first aid at Bates. But there's been problems, you know. After maybe a couple times being hurt on the job, the union, the health plan wouldn't pay for it so we would have to fight for it, we would have to negotiate, to fight for it. And we have to negotiate for contract, each contract, and then when I went to the office, the office, you know where Dube Travel Agency is? We had the offices upstairs on the second floor, that's where I had an office for five years over there. And of course when the Wyandotte Mill in Waterville closed, we lost these people, and then when the Augusta mill started dwindling, dwindling. So then they really didn't need my services, so this is when I went back, I went back to Bates. And like I say, I went back to my job on the first shift, I didn't have to fight to get my job back."
"AL:","Did you work with Denny Blais at all?"
"RG:","Of course, he was my boss."
"AL:","He was your boss? What was he like?"
"RG:","Well, no comment."
"AL:","Okay. And as part of the union, did you, well, my question really is, do you know when the unions formed? When did the union form at the mill, do you know like the decade?"
"RG:","In the forties."
"AL:","In the forties."
"RG:","In the forties, in the forties. And I think the first strike that we had was in 1951, '52, we had a strike."
"AL:","And you were there at that time."
"RG:","I was there at that time. 9"
"AL:","Do you remember what it was about?"
"RG:","Well, they didn't want to give us more wages. One of the primary things was wages and vacation pay. That was, they didn't want to, and so."
"AL:","How did it get resolved? Did they -?"
"RG:","They gave us some wages. Not much, but they, I think it was three percent, and three percent is eight cents an hour, that's not that much, but."
"AL:","Did it last a long time, the strike? Or a short time?"
"RG:","I think it was over three weeks, over three weeks. And, you know, this is when I started getting involved. I mean, maybe I shouldn't but I wanted to get involved in that, and that's how come I got involved. I was young at one time."
"AL:","Weren't we all?"
"RG:","This is twenty-five years, this Al Gosselin, and that was a banquet at Stekino's remember Stekino?"
"AL:","Oh, that's Hal Gosselin?"
"RG:","Hall Gosselin, yes."
"AL:","Oh, okay. I know his son."
"RG:","Oh yeah, the attorney?"
"AL:","Yup, and I've interviewed his wife. Very nice."
"RG:","This was the manager there, Fred Lebel."
"AL:","Yes, and I hope to interview him soon."
"RG:","He was, for me he was a godsend. He was willing -"
"AL:","Oh, these are wonderful pictures, wonderful."
"RG:","This is a school, I don't what else you can have an idea, this is the Knights of Columbus."
"AL:","Oh, you know, these are wonderful. I wondered -"
"RG:","See? This is the loom."
"AL:","Oh, wow."
"RG:","This is a float we won prizes for, for the Richelieu Club, won first prize. And I won first prize, but this is all stuff from Bates Fred had lent me. We won first prize for that, too. See what I was telling you? This is my grandparents, my father and mother, when my father and mother celebrated twenty-fifth years, this is my grandparents. The four of them were all awardees from Bates Mill."
"AL:","And this picture was taken in 1950. Oh, my gosh, that's a great picture. 10"
"RG:","That's the original, this is my grandparents when they were working at the Augusta mill."
"AL:","Oh, wow, these are fabulous pictures. What year do you think this was?"
"RG:","Oh, gee, in the thirties, '32 or '33 I guess. My grandmother was a drawing in, you know what that is? No? You know these big rolls there, it takes all the threads, eh? Okay, well they used to have harness for the loom, that harness, and they had to make a, they had a pattern, they had to follow it, they had a hook and they had to hook each thread in the harness to make it like, to be able to be, to weave."
"AL:","And that was called drawing in?"
"RG:","Drawing in, and my grandfather was a slasher man, he was making, they were taking the spool one at, there were large racks of spools that they put, and all the threads were pulled, and then they were pulled and they were combed, they were combed, and then they would bring in, they would bring it and they would comb it and put them on these rolls. These were the slasher rolls, and this was brought into the weave room and then the harness ladies used to draw the patterns. So its, I just brought you a few of the things to give you an idea. So they all worked fifty years, all had gold watch and bedspread, my grandmother, grandfather, my father had all worked at the Edwards mill in Augusta through the years. How I worked, okay, this is called Masquerade, the May Ball at the Knights of Columbus. Gives you an idea. See, there's a, I'm not going to bring everything out, it's just going to give you an idea."
"AL:","Oh, yes, and this is, wow."
"RG:","It's all in (unintelligible phrase), all this. These were masks for the wall, masks for everybody coming to the May Ball."
"AL:","Yes. You know, I can image these, but when I try to create something like this it comes out much smaller than it's supposed to be for the effect it should have. Oh, gorgeous. So the community theaters, I mean in high schools and the public theaters, really have benefited for years from -"
"RG:","See, I made these, this is all made with feathers. Each table had a centerpiece like that, and I made all the centerpieces with feathers and little flowers. See how the hall looked? It was called Masquerade."
"AL:","It's beautiful."
"RG:","Just gives you an idea how I worked. See, there was a center area where everybody would take pictures."
"AL:","Oh, that's just, I love the gold masks. Was that the back of them, or a different color?"
"RG:","No, no, no, there was some gold, some purple and some green ones. See, I got an award for that."
"AL:","Oh, that's wonderful. Is there anything that I haven't asked you about your time at the mills that you feel is important to add, maybe something I missed?"
"RG:","I don't know. I was so involved, yeah."
"AL:","Well, thank you very much. 11"
"RG:","Gives you an idea."
"AL:","Yes."
