"person","text"
"RG:","Okay, you're ready to get into that. We received an inquiry, a blind inquiry in 1982 of somebody that wanted to buy us. And I wasn 't very much impressed. We felt that the company had its difficulties as the shoe industry was declining, but I wasn 't much impressed with somebody who didn't want to identify themselves as to who was interested. Well, they got back to us a little later on and it turned out to be a company called L. Farber in Worcester, Massachusetts. Now, L. Farber was a manufacturer of leather welting, and they were the premier manufacturer of leather welting, which impressed me, and they said they wanted to buy the premier company in counters. So, well, all of a sudden our ears perked up a little bit. Oscar Scammon I think was enthusiastic about it, because he did not have a son in the business and didn't plan to at that point. I was a little nervous about pulling the rug out from underneath David, my son, but we talked about it and he said , Dad, this is the best thing we could do. We can see the handwriting on the wall that things are going to get tougher, and this is a wonderful chance to become liquid. So having that knowledge, we agreed to sell. But I'm a little bit ahead of myself here."
"AL:","Okay, well go back to where we need to be."
"RG:","I'm trying to think where that is. I had mentioned earlier that we had investigated a lot of purchasing opportunities and declined most of them. We did buy Ragano Box Toe. We also bought three counter companies, one in Rochester, New York, one in, initially, the first one, was Rogers Fiber. Rogers Fiber was the supplier of our fiberboard . They also had a counter plant, and it seemed to them that they were a little bit in conflict of interest, manufacturing something that was in competition he sold board to, so they wanted to sell. Well, that was our first purchase of a counter plant, we bought Rogers in 1964. And I'm glad I mentioned 1964 because that was the year that we decided we had to get more space. If Rogers wanted to become part of our operation , we had to have space. And so we started looking around , we had about 25,000 sq. ft. in the basement of the Cushman Building, which had served us well. So we started looking around and we found out there was space, Bob Roy had some space over in the Continental Mill, and that looked pretty good to us, and it was a lease arrangement. So we said yeah , I guess maybe we ought to take that space, it was going to be adequate for our needs. So I went over to Woody Brackett, who was then city manager of Auburn , and I said Woody, I hate to tell you this, but we're going to have to leave Auburn , we're going over to Lewiston. He says, you wait just a minute, young fella , and he said , I think we can do something for you. Well, don't you know, in a matter of a few days he had lined up some land that the Auburn Business Development Corporation owned out on Minot Avenue, said he would help us to get started, and we ended up building a brand new building of 48,000 sq . ft. out on 1130 Minot Avenue, which was the best thing we could have done. So, that happened in '64, we moved , Herbie Callahan built the building for us on a handshake, and he built it so that the two weeks of the vacation period , in Fourth of July vacation period, we could prepare to move in, and we had that two-week window which wouldn't mess up our production. And we moved Rogers in , and we moved ourselves in, and we were operational I think one week after the vacation period. And it was wonderful. We put another addition on , another 10,000 ft. addition onto the building before we got through. We also bought Prosper Chavonelle (sounds like) , which is a counter company, and then in '82, New England Counter Company, which was our major competitor, located in the Lown Building here in Auburn , decided they wanted to sell. They had merged six or seven counter companies into their counter company, and we had merged three into ours, so we ultimately bought New England Counter Company which increased our productivity twenty-five percent, and we were the amalgamation of about nine different counter companies that had existed before all this took place. Which brings me to the point that, when we got going after the war, there were thirty counter companies in the United States that produced the same sort of product we did . And when we finally merged New England in, I think there were only five left. Everybody else had either sold or liquidated or whatever. So no sooner had we bought New England Counter than this event with L. Farber came along, so we looked all the more attractive of course to Farber. And so we ultimately sold to them in '83, and Oscar Scammon decided to retire , he didn't want to become involved in the new Gould & Scammon, but Dana and my son and I all joined up, and David, my son, became president, and Dana stayed on in his various roles, as did I. And I stayed with them until the end of 1990, Dana retired I think in 1987 to live in Florida, but he stayed close, and David stayed with the company until '91 , but at that point they were having difficulties because they had gotten too greedy and bought too many other companies and ultimately had to sell off. And so in 1991 Norman Ferrar of Canada Counter Company bought Gould & Scammon, owned by L. Farber, and changed the name to Enefco, which stood for Norman Ferrar, and it continues to operate out on Minot Avenue , although Norman sold it to another group later on. And they still produce some molded counters. Not many, military largely, some, a few women's old fashioned shoes, nun's shoes, so to speak, are still being made with molded counters, and so is Redwing , out in Wisconsin, still using molded counters from this company. That is probably a snapshot of everything, and I've left a ton of things out, but maybe that's close enough."
"AL:","Yes, that's an amazing story. Thank you."
"RG:","Yeah , it's a pleasure."
