"person","text"
"(Interviewer:","Andrea L'Hommedieu) January 25, 2006 Andrea L'Hommedieu: This is an interview with Fred Lebel for the Mill Workers Oral History Project on January 25th, the year 2006. This is Andrea L’Hommedieu and we’re at the Bates Mill store that is located on - Fred Lebel: Two Cedar Street is the address, in the Continental Mill complex."
"AL:","And tell me what year you started working in the mill?"
"FL:","At Bates, or mills in general?"
"AL:","Mills in general."
"FL:","Well, my first job was basically in this mill over here. I started working here in 1952, I believe. And I started to work with my father, who used, the maintenance department. From there I went into the quality control and IE work. And I did take about six or eight months to go to school in Memphis, Tennessee learning to class cotton, and when I graduated from there I was a qualified government grader and buyer. But when I came back to work for Bates I still stayed in the quality control and industrial engineering department. Continental went out of business in 1961. Basically I stayed, I was the last person with the mill to get rid of the equipment, and in June of ‘61 the mill closed and the week after I went to work for Bates, also in the industrial engineering department. At that time Bates had three mills. They had the Edwards at Augusta, they had the Hill Division and Bates in Lewiston. I was stationed at the Androscoggin headquarters, there was a portion on the side that was set aside for the treasurer and IE department and other departments, and from there I would travel the three mills, Augusta, or Hill or Bates. That was ‘61. In ‘63, I was assigned in charge of the IE at the Bates Division, and I believe in two years I became the general superintendent, and then another three or four months I became the manager. So by 1965 I was the manager of the Bates Division. I stayed on the job until, for I don’t know how many years, and I became the vice president of manufacturing, and eventually president, in probably 1988 or ‘89. That’s after the Chinese, the Tang brothers had purchased the mill, and I was associated with them. I also forgot to mention, I did leave Bates for one year in 1983. I had a problem with the president at that time, Bill Gleason, and I left to go to work for Guilford, up in Guilford, Maine. After a year, John Wahl, who was the chairman of the board of the, this, of Bates, called me and said he wanted to meet with me and they said they were not happy with what was going on at Bates and if I wanted to come back. Tom Levine came back, and I did to help him. The only reason I came back was because my parents were not feeling that well, and Bates, I mean not Bates but Guilford was so good to me and I, if my parents were okay I might have stayed at Guilford. But in any event, with my parents, I came back. But I was pleased to get back to the operation I knew well, and Tom Levine and I tried to get this place, to make it profitable. But it was so much in debt that it was almost impossible, it was just a matter of time that the mill would run out. 1 Now, it’s quite a few years, I might be off a year or two, and I believe it was early nineties or late eighties that the Chinese had stopped, they were not paying their bills and everything else, and the mill was going to close completely. I believe they owed the city three quarters of a million dollars in back taxes, that’s the Chinese, and other bills were mounting all over the place, and they were just stepping out of it. So I approached the city and I said, hey look, do you want me to continue the operation? I’ll do the best I can with it with limited resources that I have, and they finally agreed, by all means do it. There’s so many people still working, if you can keep it going we’re all for it. So that continued for a couple of years and we struggled somewhat to keep it going, because we just didn’t have the backing and financial to make it worthwhile, so in a couple years basically we did run out of money and basically we did file for bankruptcy. And one reason we did this is the city at that time had just announced they were going to make a convention center in mill number five, which was most of our operation. So our advisors, legal counsel, said you better go into bankruptcy because with the money that you owe now and it’s seen coming out in the paper, the banks I’m sure were going to force you to pay up, so we figured by filing we’d get some time that maybe we could recover. Then (unintelligible phrase) we didn’t, so the mill was out for sale and I believe it was 19-, the nineties anyway, they were sold to, the mill was sold to (name) Mills, and they had four American Heritage brands. Their intent was to have Bates, and they had their own company, it was also as old as ours, and they had another elderly mill in the south they were trying to get together. That in itself didn’t work out, so basically the mill was closed in 2002, or 2001, and then I started my own operation as a result of this. I just wanted to keep the Bates Division going, especially on the bedspreads that we were making, they were well known, and I felt if that would stop that would be the end of it. So I took a gamble and I started a small weaving operation that I have now at the Hill Division. We’re struggling, but we’re making progress. Right now we have six looms, and I believe this year will be a good year for us. I’m getting the jacquard heads going the way it should be, so we should be able to produce and deliver to our customers. So, actually this was started in, the first loom started in September of 2002, and we’ve completed three years. Now I have four jacquard heads going, I have a preparation department to make the warps, and a slasher for loom beams, so pretty independent now, so all we do is buy the yarns and we’re pretty well on our own. We have a small dye house and all, and our product is being well received and we think this year will be a decent year for us."
"AL:","Is it that it’s grown since 2002?"
"FL:","Yes, yes, we had to start from scratch, we had no equipment."
"AL:","Did you have people that were, had worked in the mills that you were able to keep?"
"FL:","I was very fortunate to keep some of the technical people that Bates had. People like Danny Fitzsimmons who’s a tremendous technician on looms and all equipment. I was able to, because my daughter had worked for Bates in the weave room as a clerical, and she also was in charge of the cut and sew operation at the end, so she came with me with a couple of the girls that had experience in the cut and sew operation. We also (unintelligible word) Ray Bilodeau to work in the dye house, so he came over with us. Dot, an excellent jacquard weaver, also is with us. So right now we have nine people. In addition to that, we also have Leonard for designing and all, and right now he just, he left last year, he was doing part work for me designing but last year he got a job in Brunswick in one of the industries in there, and I finally convinced him to come back so he’s going to be back with us starting in February. So now I have the people I wanted in place, like Leonard will be designing, and other work that I need with Danny and the other, so we’ll be about nine people basically, so I feel this should be a decent year for us, too."
"AL:","Now, you talked about the mills declining over the years in terms of production and number of 2 workers, but there also seems to be a continuing interest in this product. Can you talk a little bit about what you saw as some of the reasons for the, was it technology or, for the downsizing of the mills, or financial?"
"FL:","The downsizing of the mills, to go back, Bates in its heyday had about over six thousand people, when they had five mills. In the fifties, the Bates Manufacturing Company was making tremendous amounts of money, I mean, they were very profitable, paying huge dividends to its stockholders and everything else. But after the fifties, say late fifties, they started a downhill slide. Competition, a little bit from overseas, but the southern mills basically were really hurting Bates to some degree. And Bates had not really kept up with the times to get new equipment, to be more efficient. For example, in the fifties when they were making millions of dollars they could have taken a portion of that and get new equipment. The end results would have been the same, but I think they could have lasted a long period. Nobody knew of all the imports coming in now. Most of your mills in the United States now are almost gone basically, there’s a very small number of mills that are remaining. If you’re a niche market, which I am in now and I’m hoping that’ll keep us going. Most of our competition from Asia, they go more in mass production. They don’t want small items, they want volume so they can keep it around the clock seven days a week, and with their labor, which is on seven cents an hour, you can’t compete with that. They have no environmental problems, they have very, very little insurance and all, so labor wise you can’t compete with that. But if you have a niche market, and that’s my belief, there’s a good possibility we will make it, and especially the product we’re doing. It’s top quality, it’s well received, and I’m proud of our product and I feel sure that if we service our customers and maintain the quality we have now, we should be fine. I might have forgotten something in regards, like I said, it was six thousand people, and then I might add, in the late fifties, I believe, Lester Martin finally took over the company. What I mean by that, he was buying Bates stock on the market for years. Well, I wouldn’t say for years, but long enough that he got control of it. And his main concern was, once he took over the stock there were five mills, (unintelligible word) was brilliant. He knew that buying the company, that what he bought it for, by liquidating the mills he would make a tremendous amount of money. Because what he paid for it and what he could get for the equipment and the product at that time could be very rewarding. And that’s how he started. He closed the one mill they had, the York Division in Biddeford, he closed that and sold all the assets, then he closed the Androscoggin and sold all the assets. His intent was to close Bates, one of the other mills, or the Hill Division at that time, which I believe was in early sixties, he had a heart attack and died. And that’s what really preserved the mills, because his intent was to liquidate all the mills, it was very obvious on that. And how I know this is one of my friends used to work for him and he was telling me on the side, he said, this guy has got plans and I know what he’s going to do. So in a way the people were fortunate that this happened, it kept them going for another ten or fifteen years. But that was the plan. Then his son-in-law took over and he had good plans. He wanted to build Bates again, and he did build, did purchase other companies to help Bates. But again, it was just a matter of just too much and too late at the time, so eventually, you know, it eroded with the York going out, and the Androscoggin, with three mills left. And I believe it was about three thousand people left at that time. The Hill Division, for financial reasons, I believe they sold that in 1972, they closed the mill and sold the building. And I believe they did the same with the Edwards, the Edwards was sold to Mr. Miller, Miller Industries, he bought it and he kept it going for a while until he had a fire, the whole thing went up and it never started again. And of course you know about Bates. When Bates closed, by the way, I might add, when I took it over we, when Tom Levine and I came back it was about a thousand people here, and eventually it went down and I believe when I took 3 over there were still about a hundred some odd people that I tried to maintain, and then eventually went out also."
"AL:","Now, the looms that you used, were some of those able to be kept from the mills?"
"FL:","The looms that I originally bought were from Biddeford Blanket in Biddeford, they were closing and these looms were available, so I went down and looked at them. They were wide looms and all, and they were using them, and they were inexpensive and that’s the reason I bought those. If I had to buy a new loom at thirty or forty thousand dollars, there’s no way I could have started. Some of the looms that I bought at Biddeford, I think the first two that I bought were five thousand dollars, which itself was high. Then the next two were like two thousand dollars, and the last two I bought was a thousand dollars, so it’s basically, I was able to purchase those because they were very inexpensive at the time."
"AL:","And you mentioned your father had worked in the mills."
"FL:","Yes."
"AL:","And was he from Lewiston?"
"FL:","My father was from Lewiston, and my grandfather also worked in the mill but he was from Canada. My grandfather, whose name was Homer, and I still remember him basically. Now, he worked for this mill, Continental over here also. Let me go back. My grandfather and two brothers lived I believe it was (unintelligible phrase) in St. Lawrence Seaway, and there was a large family, I believe it was twelve siblings. And I guess the food and work was very difficult at the time, they were actually starving, and they heard about the mills, and these were three teenagers I believe. Well, one was twelve, I believe, one thirteen and one fifteen. All three of them decided to go work in the mills, and I understand they took the Grand Trunk Railroad, they came to Lewiston and they settled over here to go work in the mills. I remember my father telling me about my grandfather was, his job was, he had a team of horses with a wagon, and Continental does not have a railroad siding, so in order for the cotton to be received he had to take his team of horses and a wagon and go to the railroad siding, which is basically by the Hill Division, there used to be tracks in there. And there was an area in there where the cars, the cotton would stand, and he’d go in, open the doors by himself, and he would handle those bales which weighed five hundred pounds at a time all by himself. He’d put it in this wagon, he’d put six bales at a time, with his team of horses bring them back to Continental, the mill we’re in right now, and unload them. And that was his job, that’s all he did all his life. And then when my father started in here, he worked in maintenance, basically in the yard, and eventually he became the supervisor. And it’s amazing in a way, because my father had very little education, he couldn’t write. But they still gave him the job because of his, how shall I say it, perseverance, and he was a hard worker and everything else. He was well liked."
"AL:","And what was his name?"
"FL:","Wilfred. My grandfather was Homer and this was Wilfred. And so he worked here all his life, so when the mill closed in 1961 he couldn’t believe it. I believe he had worked here about forty years then, and he was still, I think he was about sixty years old, in that area. Then he went to work for Bob Roy, and Bob Roy knew my father, knew the type of worker he was, so he gave him a job. And my dad worked until he retired in ‘68, and he had lung cancer and he died I believe he was eighty-one years old. And my mother worked in the mill. My -"
"AL:","Your mother did as well. 4"
"FL:","My mother also was a doffer and my grandmother was also a spinner-doffer. So the family itself, most of our people worked in the mills. What I remember that stands out as far as my grandmother and my mother, my grandmother worked at the Hill Division as a doffer-spinner."
"AL:","And what is that?"
"FL:","They, a spinning frame, they have bobbins, and when yarn is processed from roving it makes yarn on small bobbins and they got to come off the frame. So what they do when they’re filled up, the frame stops and they have to take the bobbins out, the full ones, and put empty ones. And work was very difficult in those days, people were waiting in line for work, but the people that worked in the mill were pretty clever in a way. What they were doing is, like my grandmother was on the first shift, I don’t know how many hours, maybe eleven hours a day, so my mother would bring her lunch, maybe she was nine or ten years old, bring her her lunch at noon, and while my grandmother was eating her lunch, my mother would start working to learn the job. So that’s how they learned, with their mother or whoever it was. So after doing that for maybe a year or so, and again my mother maybe only twelve or thirteen, she went to work in the mill so when there was an opening she went in, does she have experience, oh yes, I’ve been doing, then she would show them what she could do and then she was hired. So my mother, again, all her life spent in the mill as a spinner-doffer, and when the Hill I believe closed in ‘72, then she came to work at the Bates Division in the finishing room, and she was a mender. She stayed there until she was sixty-five or sixty-six, then she retired. She just passed away about four years ago at ninety-one or ninety-two years old."
"AL:","And when you were thinking about going into the mills, what age were you?"
"FL:","When I started, I came back, I attended Bates for a couple of years and then I went to the service, I went to OCS in Fort Benning, Georgia. I had a bad knee, I got banged up in the service so I came out of the service. But while I was in the service I got married to my wife Theresa, and so when I came back I didn’t go back to school, I came back to work at Continental here for my father, so I thought maybe I’ll go to school after, but I never did."
"AL:","So was your father working in the mill a help to you getting the job? Was it hard to get into the mill in your generation?"
"FL:","I don’t remember. I don’t think it was that hard. Well, at the time, yeah, I did have a chance because I knew my dad, he would hire me, and I used to just in the summers while I was going to school. And as far as the age, I believe I was twenty-two when I came to work in the mills, when I started. So, and from here, like I said, I worked there then I learned cotton classing. In all your mills you used to have what they called a cotton classer, a cotton buyer. All the yarn, not the yarn, but all the fiber comes to a mill. People probably think, well a bale of cotton is a bale of cotton. Well, they’re all different, they have different lengths of staple, goes anywheres from thirteen sixteenth of an inch to an inch and a quarter. The longer the fiber, the more expensive it is. You have about six or seven different colors of cotton. You’ve got white, you got stain, you got tinge, greys and all, and these all have value. And when you make fabric, you got to make sure you have the right staple, you have the right color, and what they mean by preparation, that it’s nice and smooth, you got the microdenier, you got to be, so I was learning this with Norman Fisk that used to be the cotton classer over here. While I was working with my dad, every time he needed me he’d call me and I’d go help him, and I started to learn how to do cotton classing. And after a while he was letting me do a lot of his work. He used to play golf at Martindale, and one afternoon, I don’t remember what age I was, but he went to play golf and going up the first hill he had a heart attack and he died. The mill agent at the time, Vernon 5 (name) who was part owner in all knew that I did some work with Norman Fisk, and he called me in, he said, Fred, he said, I know you worked with Norm, can you take this over? I was scared. I didn’t know at the time, I said, I don’t believe I can do this to that extent, and he said, well, I appreciate your honesty. So they hired somebody from Rhode Island, and when this individual came in and he started doing the cotton classing, he started getting me to work with him and I realized that I was more capable than he was. So I said, wow, but I (unintelligible phrase) the experience anyway. So at that time I made up my mind, I said I’m going to go to school to learn this if this comes up again. (Interrupted.) And as I was saying is I said, when I saw that, then I said I do the school in Memphis. It’s the Murdoch’s Cotton Classing and Buying School, and I said, I’m going to go there. I had just been married, and I told my wife and she thought it was a good idea. So I told the company that I needed some time off, that I would go there and I was hoping that they might, and they couldn’t at the time, they said, no, we can’t help you with that at all. So I said, well, look, I’m going down. So I did sign up for the school, I went in, I know I drove down to Memphis, and I did the school, I did everything that was expected of me. It was like an international school, you had people from all over the world learning this trade. And the fact that I had experience before, when I finished that school I was qualified and I had a license to be a government classer. In other words, I could go work for the government. I don’t know what, P-grade or whatever it was, but it was fairly good money at the time. And the fact that, like I said, I worked with Bates before and with going to school it gave me five years of experience, and then I did have the government license but I never took, I just came back and I came back to my job over here and they were pleased to get me back. And I said, well, if it happens again, I’ll be ready. But in the meantime, a year or two later something happened and I went into the industrial engineering department and quality control. And eventually in another year I was running it over here, I was in charge of those two departments until the mill closed, as I said, in 1961."
"AL:","And what sort of was your job in that position?"
"FL:","I was in charge of quality control and industrial, time study work basically. I believe I had about three people in here that were working for me, there was about one other person in quality control, which is doing checks in the mill for, checking yarns, making sure your quality (unintelligible phrase) of sheeting. Continental here was known for very high quality sheeting. They used to do government work in parachute cloth, handkerchiefs. It was a well-known mill as far as quality, and this competed with the Hill Division, but basically the products are basically the same. But the department, the time study was doing engineering work for job evaluation, time study work, more like efficiency experts, so that sorts of job. And when I left this mill to go to Bates, that what I stayed in basically, in quality control. Not really quality control, but the time study work."
"AL:","And you said that especially in the early days when your grandparents were working in the mills it was very hard work, it was very manual labor. How did that change over the years, that you saw, in terms of dangers to injuries?"
