"person","text"
"FL:","Oh, as far as the mills, I could go back from the experience of what I heard from people, when the Bates first started, and I’m going back like the 1850s and ‘60s and ‘70s. Remember, there was no electricity. Everything was waterpower. In other words, the hydros and all, and by shafts and belts, this is how the equipment used to run, and what was dangerous then is, like a girl like you, with hair like you have there. The chances are, if that wasn’t tied down you could be scalped, because the belts going by, if your hair got caught in there and then. That happened, and it was very dangerous in that respect. But after the electricity came in and they got rid of the belts and better equipment, it was just more efficient. People still worked fairly hard, only the hours got shorter. In the, like early 1900, they were working fifty-four and fifty six hours a week. I believe it was ten hours a day, five days a week, and 6 six hours on Saturday. That was their week, fifty-six hours basically. And I know in 1912, (unintelligible phrase) the State made a new law to cut it down to fifty-four hours, from fifty-six, but the people felt they’d cut pay if they did it. That was a major strike then, it was a real problem then in 1912. But the hours got shorter, you know, and eventually down to forty hours. But exactly over the years how it broke down is, all I knew at first was in the sixties and eventually down to the forties, that’s what made it much better for the people to work in here. And keep in mind the mills, too, were a three-day operation. In other words, they had people on the first shift, second shift, and third shift, it’s twenty-four hours straight. Simply because the equipment’s so expensive, if you bought equipment you didn’t want to run just one shift, you’re running three shifts so you want to utilize the equipment as much as you can. Now, the mills in the south, they used to work six days a week around the clock, but they had an advantage, they didn’t work, I don’t think they paid overtime on Saturdays for a while, until the federal laws got into effect. But they used to work six days a week. Now as far as the hardness, people still worked fairly hard. And of course being in the industrial engineering department, people were allowed fifteen percent of their time for personal. In other words, in a day there were allowed seventy-two minutes to take breaks, to have lunch with the rest room and all, and that was pretty standard. You set up workloads for people to work, you know, for most of the time except for those seventy-two minutes. And we took studies. In our department at Bates we had I believe it was eleven or twelve people working in there to do time study work in all the three mills at that time. So this is how you tried to keep your labor cost in line, so you wouldn’t want somebody in a department working seven hours a day and having their seventy two, and then somebody else would be working four hours, and that created problems. Plus the fact your costs would be too high, so our job was to make sure everybody worked, and make sure that they were not overworking also. And so we constantly took time studies and that’s what we tried to do."
"AL:","And what is your date of birth?"
"FL:","March 5th, ‘29."
"AL:","So you grew up in Lewiston late thirties into the forties where you can remember -"
"FL:","My home is right across the street here."
"AL:","Is it?"
"FL:","On Cedar Street, which is part of Little Canada basically. As a matter of fact, when I worked at Bates, we got married, my father owned the apartment house and I used to work in the, live on the first floor and all I had to do is go across the street to work, so, basically, so it was convenient. Then in 19-, I believe it was 1963 I bought some land on Randall Road and I built my house in which I am today."
"AL:","What was Little Canada like, and the larger Lewiston community like when you were growing up?"
"FL:","I would say Little Canada was a very close-knit group. I mean, we never locked our doors, or, I mean everybody was friendly, and you don’t have the problem that you have today all over the United States, I mean right now if you don’t lock your doors you’re going to lose something, somebody’s going to come in. But people were, as I said, very friendly, no problem, hardly any problem. Oh, you still had a few people breaking a few windows here and there while they were playing around, but most of the cases it was pretty quiet, pretty friendly, and everybody seemed to get along fairly well."
"AL:","And what did you and your parents do for social activities? Was it centered around the church or the people you worked with in the mill, or a combination? 7"
"FL:","A combination basically. There was St. Mary’s right across the street from us, the church, and that’s what we used to attend. And my parents basically both working, they’d come home at night and rest basically, and my grandmother at the time, they were taking care of her also. But I remember them just going to work, coming home, and they’d go out for a ride or eat out once in a while, but most of the time they’d stay home. And of course then you got television in the fifties, then that was their new hobby. They got a TV set and they watched that all the time."
"AL:","Were they both on the same shift at the mill?"
"FL:","Not at first. As I remember my mother saying, she was working I believe it was the second shift, and she’d come out at night to make sure that I was fed and everything else. My dad was on the first, she was on the second shift for a number of years. Then eventually she was on the first shift also."
"AL:","And were you an only child?"
"FL:","Yes, yes."
"AL:","And so your grandmother grew up in the household with you for some years, or was that later years?"
"FL:","That was later years. Well, I remember, well maybe I was ten or twelve that she was living with my parents right here on Cedar Street. They bought a house, I believe it’s 51 on Stewart Street, and that’s when they moved out of here. And that’s when I took it over, I mean basically, I had just got married and they said, well if you take this apartment house, you’re working over here, it was somewhat in the early fifties if I remember correctly."
"AL:","And did they speak French in the home?"
"FL:","Most of the time, they spoke very little English. My father enough to get by, that’s why he became the supervisor, and my mother could speak a little bit. But I would say ninety five percent of the time they would speak French, French Canadian."
"AL:","So that was probably your first language, when you went to school you had to learn English?"
"FL:","It was, it was, I was at St. Mary’s matter of fact in the fourth grade, my mother wanted me to learn English so she trans me over to Coburn School at the time, it was a public school. Then from Coburn went to Jordan and Lewiston High."
"AL:","And in terms of economically, Lewiston was a pretty vibrant shopping center at the time you were growing up, is that what you recall? Or maybe not?"
"FL:","Not really, to be honest with you. You know, you’re growing up, and I don’t think I observed that at all as far as the shopping centers and everything else. I know they were there. To what extent, how it would compare to other places, I really didn’t watch that too closely."
"AL:","What are some of the experiences that you had working in the mill that stick out in your mind over the years?"
"FL:","Well, some of the management people on top of us. When I became a VP or a plant manager, I used to travel to New York, and I did notice a lot of activities were going on that I didn’t think were too bright, if I may say so. Some of the top management would spend money foolishly in New York. There was one individual, I won’t mention his name, but he had an office and it was ridiculous the amount of money he would spend on that, with plush carpeting and walls and thousands of dollars, and I knew at 8 the mills that people were just struggling to get by, and I thought it was a lot of waste of money in the top management in New York. But most people were fairly good, but those few individuals, basically. Now one thing that still stays in mind, Bates, after Arnold Ginsberg took over, decided to get into the production of polyester fibers and he hired this man to build a plant in Virginia, I believe. I think today it’s Philips, but it was a small operation at the time, he built a fiber plant producing. And I remember after a couple of years when it was ready to go, they, and they had an opening day, this gentleman that was instrumental in building this plant, invited everybody. And I know Arnold Ginsberg, who was the president and owned the whole thing, was (unintelligible word). And I remember somebody asking this guy that was in charge, who built the whole plant was asked, are you going to be there? He said, no, he said, that darn thing might blow up, he said, I’m not going to be over there. And he wasn’t, he never showed up. But it did start and all, but it was a very small operation so it never did compete, but he did sell it to somebody else who, he got involved with, Philips I believe ended up buying it. And Arnold Ginsberg also had bought Virginia iron and coal, and these were coal fields in Virginia and West Virginia. And I know he bought that fairly well as far as money and I believe another, three individuals came in when Mr. Ginsberg needed money to keep these operations going, he got some people in from New York for investments. And these three people came in and I remember lending Arnold eight million dollars, that came out in public, for, to keep the mills going and they would, you know, take some responsibility in the mills. But after three or four years they more or less took control of it, and they bought Arnold out, he went out with another company and they took it over. And I remember that it was just around the energy crisis, so those coal lands, 1976 I believe, the amounts of monies that they made as a result of that for the small investment of eight million dollars, they got coal land and all that was worth hundreds of millions of dollars, so they did very well, they were sharp businessmen at the time. That’s one of the things I remember. In the mill itself, I remember one of the individuals in the dye house, a very friendly individual, you talk to him, and very well, popular with the people. I know one Monday morning he came in, and he went to the dye house and undoubtedly had some problem because he hung himself in the mill, he was right there. So we had a few people, like one that, I mean, took his life this way, or we had a few accidents and probably people got hurt, and these are things you remember. But one good thing is, most of the people were very cooperative and worked very well. Lucille Blais [sic Barrett] used to be the union president, and she worked in the cut-and-sew operation; very good person to work with. She was a fair person, she represented the union but she was also very fair to both ways, the mill and the people. And she, I believe she got her daughter through college through the mills, and many times she’d mention how good the mill was to her and provided livelihood for her family and all. Quite a few people like that. I mean, these people now worked here for like thirty, forty, fifty years, so, and Lucille was probably one of the best stitchers the mill had so she earned her money, because she was a fast and hard worker. She did very well."
"AL:","You mentioned the unions, and that brings to mind Denny Blais who was the, like the New England agent for the textile workers. Did you, in your position did you have interactions with him, and if so -?"
"FL:","Yes, I knew him, I had meetings with him, I knew him personally, and I would say Denny Blais was one of the smartest persons I ever met. You could go to, every so often you’d have arbitration or something, things that management and union would not agree. And if you went to an arbitration and Denny was the arbitrator for the union, his record was very good. And what was amazing with Denny Blais was, you could go to an arbitration meeting, it might last for two hours, he had no notes. Everything was in his head. I mean, he was, this is with, he was a brilliant man as far as I’m concerned. I remember him speaking for hours without looking at notes and all, and he was excellent. I always wanted to be on 9 his side because he was so good."
"AL:","And talk about, if you can, some of the social activities that were connected with the mills. I know there was, I don’t know if you were involved personally, but like the baseball team, and."
"FL:","You had baseball, you had softball, you had bowling. And also Bates every so often would have, would rent a rink and have skating parties for the employees. Now, in 1950, which by the way is before my time, I wasn’t here then, was the 100 Year celebration. And then the, oh, what’s his name, I’m trying to think of the, Maurice Chevalier, he was hired, or they got him to come to Lewiston and his entourage to sing at the Lewiston Armory, you know, the employees were there. So Bates went out to help to some degree. And they used to have a meeting, which I was involved a few times, with the employees when it was twenty-, every year they had twenty five year employees. Well, you can imagine, you have two or three thousand people that, every year that have a number of people that would have, be twenty-five years. They would go to the Poland Spring House, that used to be, I don’t know if you’re familiar with that, okay, that was, every year they used to do that, they’d go to Poland Spring and all the people that had twenty five years or more were all invited. So it was all a gathering every summer, they would hire the hall at Poland Spring. That was a fact it was done every year. And of course when the mills started closing that backed off a little bit. But its heyday, when Bates was doing very well, that was very common for them to do."
"AL:","Were you involved in any of the bowling or baseball?"
"FL:","Yeah, I was involved with the baseball basically, to some degree. And in bowling, I used to be a part of it, I joined one of the leagues to be with them to some degree."
"AL:","And over the years you’ve probably seen a few strikes at the mill."
"FL:","Yes."
"AL:","Do you, can you talk about that, what, the ones you remember and what, why they occurred and what the resolution was?"
"FL:","I’m trying to think, I believe it was probably 19-, late 1970s. I believe the people wanted to strike because they wanted, I believe it was a money issue, they were trying to get additional monies. And I remember that I was in the mill with (name) Lambert who was president at the time, and the union had said that if we don’t have an answer by a certain time, we are striking. And I remember at eleven o’clock, I don’t remember if it was a Friday or Thursday, whatever, when it came to that time the people walked out of the mill, who were still in the mill at that time. So it was expected that they would walk out, but within a few days after it was settled. That’s one that I do remember. I know I’ve gone through like three or four of those over the years, but there was one way back, too, I believe, we were out for three or four weeks, and I believe that one might have been in the sixties but, about that time. But most of them were resolved, you know, either a few days or a week or two. The longest one I remember I think was three weeks, around that."
"AL:","Do you recall Hal Gosselin?"
"FL:","Hal Gosselin? Yeah."
"AL:","What was his role at the mill?"
"FL:","Hal was assistant to the president. As a matter of fact, I have to give him credit for getting my job 10 as the plant manager, because he recommended me to Frank (name) who was the president at that time for that job. Hal was a very knowledgeable man. Like Denny Blais, he was very sharp (unintelligible word), Denny was on one side, Hal was on the other side. Hal was smart and worked awfully hard. And his office basically was where, if you’re familiar with Bates, where Turgeon, Al Turgeon is right now, in the executive office, that was his office basically. And Hal did a lot of traveling, he’d go to New York and represent the president and, if the president, which was Arnold Ginsberg, Al would take care of him basically. Hal did all the public relations in this area; he did an excellent job with that."
"AL:","Is there anything that I haven’t asked you that you think I’m missing in terms of your memories?"
"FL:","Well, the other thing is basically, I might add is of course, Bates in 1976 became an ESOT company, Employee Stock Ownership Trust. That’s when the, in the end they had run out of money and they, again, those three individuals that took over the company for eight million dollars and got all this land and all the money they make, I think his name, well one of the individuals was very familiar with ESOTs and he knew someone on the West coast in regard to establishing an ESOT, so he worked at that and he was finally able to convince that was the way to go. I think at that time, the late, I’m trying to think, late ‘70s or ‘76 if I remember correctly, he was not happy with the result. He had taken over the Bates mill and he had all this money invested and making one percent or two percent was not enough for him. He was a real financial man. His intent was to make money. He didn’t care of people or what. I have money invested, I want a return or else. And I think at that time, I think he had three options: one was, if I can sell the mill to somebody else, that’s probably one of the best things to do that I could, you know, recoup all this money and all; and another one was, if I don’t I’m just going to liquidate it and take whatever I can get for the equipment and bail out; and the other one that came up was this ESOT, that I probably can have the employees take over the mill. And I believe it’s for seven million dollars at the time, seven or eight million dollars, they worked with the Farmer’s Home to, they would lend the money to the employees, and the Bank of Boston was involved with it, and I believe he got eight million dollars for that transfer at the time, that the employees would take over - End of Side A Side B"
"AL:","We are now on Side B. I’m sorry, go ahead."
"FL:","No problem. And the debt, I mean, Bates still owed like twelve million dollars in the books, so besides borrowing eight million dollars, I believe they still had twelve million dollars of debt that they had to take care of. And in the late ‘70s, if I remember correctly, that’s when the interest rates started to go ridiculously high, and I think it went up to eighteen or nineteen percent, so not only did we have to pay X number of dollars per month to the Bank of Boston, but all the interest made it impossible to make any money. It’s, a matter of fact the first month we were on our own, we were in violation of the agreement at the bank, we were not able to maintain anything, so that’s one of the reasons that Bates was not able to make it because they were in a deep hole, they just couldn’t get out of it. Not that it would have made a difference. Sooner or later it would have gone out anyway with the, the way the activity is today. But this Employee Stock Ownership, the people had a real interest in that because they felt that, wow, we got a chance of making some money in there. And if I remember correctly, I think the shares, the stock on the (unintelligible word) at one time went up to either a dollar-fifty or two-fifty, so people felt great about it, wow, two dollars and fifty cents a share. And, but it started going the other way, and then it was pennies, and then hardly anything. And of course when the plant closed it was nothing. We still have people calling today that want to know if, that used to work here passed away and 11 they must see the shares of stock, they’ll call, what is this worth? And it’s unfortunate, you have to tell them it’s worth nothing. Or they had life insurance, that when the mills closed that, you know, it became worthless. I think I had, two weeks ago somebody called me, somebody that worked here, and said, well, I notice an insurance. I said, unfortunately when Bates went out these were worthless basically. That’s one thing I remember. And Bates had companies, they had a small plant in Canada, too, basically, that they had set up. And they were trying to circumvent I guess the taxes on cotton, it would go up to Canada, they’d process it, they would bring it back to the States and save all kinds of money. But by the time they got it going, the government stopped it, and actually it was Waterloo, and that’s what it was, it was a waste of money up there. So a lot of money was wasted basically. And of course the other thing, keep in mind, Bates Manufacturing at one time owned all the water rights. And that’s, unfortunately they sold it, they lost all this potential money they could have had. Again, it’s when they had a shortage of cash, they sold it to I believe it was the Lewiston community, it was the city that bought it over, and then they turned around and sold it right back to Central Maine Power. Bates at one time, I don’t know how many kilowatt power they had, but they had three wheels at Bates, four or six wheels at Hill, and a couple of wheels at Androscoggin. And that was a real moneymaker, but unfortunately they sold it before the full value was effect. So Central Maine Power now, it’s got all of those."
"AL:","Great, thank you so much."
"FL:","Well I’m, over the years I’m sure I’ve forgotten a lot, but as you get older you do forget a lot."
"AL:","Well you remembered a lot today, so thank you very much."
