"person","text"
"(Interviewer:","Andrea L'Hommedieu) March 14, 2006 Andrea L'Hommedieu: This is an interview for the Mill Workers Oral History project. The date is March 14th, the year 2006. This is Andrea L’Hommedieu, and today I’m interviewing Lilliane Morin at her home on Lisbon Road in Lisbon, Maine. Could I start just by asking you to say your full name, including your maiden name? Lilliane Morin: My name is Lilliane Adelia Morin, Lilliane Bernier."
"AL:","And what’s your date of birth?"
"LM:","December 22nd, 1934."
"AL:","And did you grow up in the Lewiston area?"
"LM:","Yes, I been in Lewiston all my life until forty-five years ago we move over here, it’s going to be forty six now."
"AL:","And what was growing up in Lewiston like in the ‘40s and ‘50s?"
"LM:","Well, I think it’s a lot better than what’s going on today. Yeah, the life was simpler, you know, we didn’t have everything. We were, they were poor, they worked, and my mother remarried and they worked in the mill, also, both of them worked in a textile mill, the Hill Mill. And so we were not financially, you know, they were not financially, so but we made it all right, though. But I, before that, before she got remarried I stayed at the orphanage, St. Joseph, there? We call it Marcotte Home. I stayed there until I was almost thirteen, I was twelve years old when I left the orphanage, because they got married and, but they took us out, you know."
"AL:","So it was a matter of being able to afford to feed you?"
"LM:","Yeah, that’s right, that’s right."
"AL:","And how many brothers and sisters did you have?"
"LM:","I have one brother and one sister, and I’m the oldest one. And my, then my stepfather had two kids, a boy and a girl also. But they stayed just a little bit with us, and then after that they were taken care of by their mother, you know, so they lived there."
"AL:","Was the orphanage run by the nuns at that time?"
"LM:","Oh yes, yes, and sisters, I’m French, you know, so I don’t say my words correctly in English, Sister St. (name). Well, I cried when I heard she was going away. She had a stroke apparently, and I went to see her and I cried, I cried. And she remembered my name, Lilliane Bernier, you know, she didn’t forget me at all. I was so surprised, you know, and I loved her, she was like a mother to us over there."
"AL:","So they treated you well. 1"
"LM:","Oh yes, I mean, you know, it’s not home, it’s not everything you want as far as the food. Oh, some of the food, though, wasn’t great, you know. But it’s not the same thing as living at home. Some of the kids were going home on weekends, and I was there all the time because I was a State help, you know, had help from the State. So, and, so that’s the way it worked. But yet, I think, God, today, realizing what we went through, what the, you know, the way things were, that I was lucky to have a place like that to stay. And I wish there were something like that going on today, you know, for the kids that don’t have homes or anything like that, you know. It was strict, but it was, it was okay, you know, I was not punished too much. Except one time, I said some bad words and they took soap and a toothbrush, washed my tongue. And I got sick, too. Never forget that, (unintelligible phrase). But in all, it was a good place to be, you know, we were lucky."
"AL:","And so your mom and stepdad both worked in the Hill Mill?"
"LM:","Yes, they both worked in the Hill Mill."
"AL:","What did they do there?"
"LM:","My mother was in the spinning room, I know she worked in the spinning. And him, I don’t remember too much what he was doing. I heard about card room, I think, before. I never paid attention what he was doing, you know. But the Sirois family worked in the mill, all of them, I think, most of them all did work over there, you know, they were living in the Hill Blocks at the time, some of them were there. But us, we were 313 Lisbon Street. So, yeah, that’s, that was quite a thing, to think back, you know. We had some good memories, some bad memories, you know, the past, you know. But in all that time, I always teach my, I always tell my kids or my nieces and nephew, if they complain about their life, what they have today, well, I say, now your age, you’re the one who makes your life. It’s true, it’s not, you can’t blame the parents what they did wrong or right, you know. Especially what they did wrong, you don’t go by that. You have to make your own living, you know, you have to make your own life. And whatever you do, it’s up to you. That’s what I feel, you know, I feel like that, you know. That’s it on that part."
"AL:","And you lived on Lisbon Street, and so you were close to the downtown shopping area."
"LM:","Oh, yes."
"AL:","Tell me about that (unintelligible word)."
"LM:","Oh, that was the most beautiful place we had downtown. We used to walk, when I met my husband, also he was across the street and he move in the same building, and when I met him we used to walk and hold hands. There was, at that time it was the High Park, it was not called Kennedy, it was Parc en Haute, you know, en haute, you know, it’s High Park. I guess that’s how you say it in English. And we used to have concert over there. The lifestyle of living was altogether different from what it is today, and we used to, the stores, oh. Ward Brothers, Francis Store, Bell Shop, I mean, you know, you walked, just looking in the windows, you know, because we didn’t have a car or anything and we were just dating a little bit, you know, and we used to walk. And I remember there was a vaudeville in Auburn I think, was it Lewiston? Auburn I think it was, or I don’t remember now because if was Lewiston or Auburn. My husband and I, we used to go see the vaudeville, you know, so that’s a long time ago. Ages. But the thing is, downtown Lewiston was a lot, there was beer joints, okay, but you never had anything what goes on today at that time. It was really nice, you know, you didn’t, didn’t bother you or anything, the drunks didn’t, there was not so many drunks. I think there were some, but you didn’t see them as much as you do today, you know. But it was a good living. We had, I think it was better, it was a lot better than what it is today, considering, because the Lisbon Street was beautiful at that time. Today, I don’t think so. Today you go 2 by, by car and you look and it’s disgusting, you know, to see, now you have all lawyers and everything like that on Lisbon Street and that’s all you see. You don’t see anything, stores like we used to have. We had grocery store, cleaner in, right, in the building with the cleaner, where we used to live. And across the road was Blanche, you used to have, and Frank, we used to stop over there, go over there. Met a guy, it was mostly a friend, not a real boyfriend, he was so cheap he couldn’t even buy a cone of ice cream. But we used to go to Frank to buy a cone of ice cream, you know. And there was Vaughn Clothing Store, and we used, and (name) was across from us, too, also, and I used to run clubs for their clothes, you know. My mother-in-law always took clubs over there and dressed me up, and then I started running clubs over there which was really nice, you know. So I enjoyed it, really, the Lisbon Street was a lot better. Even Knox Street and all that, so, I’m going to tell you something in a minute, can you turn it off for a minute?"
"AL:","And so, I wanted to ask you if, when you were staying with the nuns, if they put you in school. Did you go to school?"
"LM:","I had spinal meningitis when I was ten years old. I was going to St. Mary’s, and then I went in there. It’s confusing, my life, I lost my memory, well, then I was in there, so and I lost memory and they, I remember going, a big nun, she was a big nun, I don’t know her name, it was, I think it was the first grade. But I never did anything really to learn. I don’t remember learning. The only time I learned something that I remember was St. Mary’s School, we had sister St. Agathe, that’s how I lost this, here. I got this, this is fake, and I dropped it and I got the same thing again, the same thing (unintelligible phrase), that why everybody recognizes me. But as far as schooling in there, I don’t remember. Because there used to be some doctors come and check on me, to make me think, you know, I guess to memorize, you know, things. Because that’s what I did, I lost memory when I was younger, and partly there. And so anyhow, that’s what happened. But as far, the only time I remember school is at St. Mary’s, really. But the orphanage, I don’t remember school there."
"AL:","So, do you know what age you stopped going to school?"
"LM:","Yes, I went to, my mother took us out of St. Mary’s School to go to public school, because we didn’t know how to speak English. And so we went to Coburn School, and I had Miss Helen Harkin, was the best person, but I didn’t even speak English. And so I had a 100 in spelling, but didn’t know how to speak English at all. And then after that I went to Jordan School just for two months, and there was, where we were living there was a bridge on the porch, the porch floor, you know, there was a bridge to get out and I had moccasins on I guess, and I fell on my spine and, tip of the spine, so, and it was hurting so, and then after that they, my mother said, went to the hospital, I needed surgery, I had, it was all chipped, you know. So a Dr. Gauvreau operated on me. I was fifteen then. And then after that they said, my said, well since you’re so much in the hospital, missing school, you might as well go to work. I turned sixteen in December, see, that was between September and October I think I fell down, so I went work at the shoe shop. I was sixteen at that time. I was told to go."
"AL:","And they let you -?"
"LM:","Yeah, at that time you could go to school, go to work at that age, at sixteen, at that time. Gee, I happen to be seventy-one. Can’t you imagine all these things that happened? But that’s what we did anyhow, so I went to work."
"AL:","Was this full time?"
"LM:","Yes, full time, shoe shop. And when I got to be eighteen, I married my husband one month before I was seventeen, and I’m not sorry. It’s going to be, it’s fifty-four years of marriage, in November it’s going 3 to be fifty-five married, would you believe. Can’t believe I did that long, you know. But anyhow, so then I went to work in the mill when I was eighteen, Bates Mill, I started there in May."
"AL:","And what jobs did you do there, how did, what did you start out at?"
"LM:","Oh, my gosh, I did that, in the weave room, Number Five weave. That was, I had a lot of fun in that room. There was a, you worked, I was a battery hand, and we had magazine, you know, four of them, you know, you had yarn, the different colors, you know, to put on each (unintelligible word) the four. Then I worked on the C-4s, I work on the C-Ks, C-4s, and there was a little machine that came in later and I got to work on it, and I forgot how they call it, and they make plaids, material plaids to make skirt or, you know, outfits with that, jumpers and all that. And that’s what they did for that. That didn’t stay too long, though. But I mean, that was the best room. I work in Number One and Two, that was a total white material and the batteries are round on that one. That was a toughie I think, that’s too much, you know."
"AL:","So what is you liked about the weave room, was it the people or the job you -?"
"LM:","Oh, the people and the job I had, you know. I did love the job I had. And then I went to work, I stopped, I went down in the cloth room because the doctor said I couldn’t be upstairs, so, in the weave room."
"AL:","Because?"
"LM:","Because my womb was dropped, you know. So, because I couldn’t get pregnant, and I said, the doctor put his hand in the wrong place, then I found out I was pregnant, you know. And the womb was tipped, so that’s why I went to work in the cloth room, and I stayed there. That was nice, too. And then I went to work in the, I stopped, had my daughter, then I went back in, I worked in the fringe department. That was nice, too, that was a nice room to work. And I was there twelve years and a half in that room. Because they closed the room, that’s why the department, you know, so they didn’t make it, they still make more fringe, I hear, but they have another section of the mill where they do it. And I think they’re still making some, I hear, from another part of the mill. And then I went back, after they closed I went into the packing room, worked for Ralph Nelson. And then after that I went downstairs, I was still working for him, I worked downstairs on the sealer. You put the bedspread in the sealer, you know, in the plastic, you know, we (unintelligible phrase), so I did that, I did that, too. That was the last place I worked, and the last time I worked was in the cloth room. So, with (unintelligible phrase) packing. We’d put a bedspread on a belt and then it went up, and the girl upstairs packed it, you know. So that’s what we did."
"AL:","Now, the different areas of the mill you worked in probably had different working conditions? What sort of rooms, how was the air in the different rooms?"
"LM:","Well, in the weave room it was hot and it was humid a lot, you know, it was very humid, and it’s dusty a lot, it was very, very dusty. I’m surprised I don’t have any problems with that. And the fringe department, I used to be a creeler, we call it a creeler. We had big racks, you know, and you put the, it was rounded, the yarn that we put on, then we put it on the machine like that. (Telephone interruption.)"
"AL:","And you were talking about -"
"LM:","Oh, the humidity and the dust, and the grease also, you know, you have to be careful. And sometimes the shuttle pass[ed] right in front of you. One time I had the, I remember we had Mr. Michel, I’ll never forget him as long as I live. We got, I’ve got a piece of movies of that department. 4"
"AL:","You do?"
"LM:","Yes, yes, I’ve got that. I’ve got the, I was tiny, the kids didn’t even recognize me on that picture, I was small, with a ponytail and (unintelligible word), you know. (Unintelligible phrase) blouse and slim skirt. Well anyhow, I was wearing a flare, you know, we had petticoats in the fifties, you know, so I had a big petticoat and a flared skirt, too, and I got caught in the gears in the machine so, I was working with, she was a single woman and she was a weaver, and it was on the C-4, C-Ks, wait a minute, C-4 or C-K? C-4's the big one. C-Ks, yeah, and then after that I got caught in that, so it took about four or five person to get me out of there, you know. My skirt was torn, you know. And so, and they said I had to wear pants, and I was not the type that wear pants, was only in skirts at that time. So she said, so he said, you have to wear pants. I said, okay, I’m going to wear shorts. And I was the youngest one of the place, so they took measurement, how far I can, my shorts an be worn, you know, they measured. Oh, but poor Mr. Michel, oh, we had fun with him, oh. Like Ray Berube, I don’t know if you ever heard of him. Oh, he was a hellion, oh, he used, he’d sit me on a box of bobbins there, on top. I was small at that time, only 98 pounds, so he’d sit me on the box of bobbin and he said, so the boss come by, get down here. Well, I can’t get down, I (unintelligible word) jumped up, I said, they put me up here. So, and he used to, oh, fool around, him. Oh, the things he did in that place. But he was a good worker, a good weaver. I got him in the movies also, yeah. I’ve known him since I was a little girl, a baby I think. But yeah, that was a fun room to work. We had Christmas parties and, you know, and so they brought, everybody brought something, so we had good times. The people were nice in there. And in fact I have some friends, I still see a lot of the people that I, we used to work with, you know. Even the guy that I was, he was my weaver and I was his battery hand, you know, also with him, so I see them, too, also again. And they are, they were, I call them my friends because they, you know, I had a good time with them, and I worked, and they help me out too, also, you know. It was good. I enjoyed that room more than the Number One and Two. Number One and Two, the people was not as friendly as Number Five, you know, Number Five weave was the best room. And the cloth room, well that was something else, too, you know. But as far as the dust and the, we had to clean, in the fringe department we had to take a vacuum and clean the, they had eye thing to put your yarn that was going straight, you know, to, (unintelligible word) weaving in a way, they were (unintelligible word) fringe department. So the boss told me I had to clean, and so that day I was so tired, we had Roger Boyd, we had (name), he was my operator, and so we had Albert, the single old man, you know, he was older. So sometimes I got the yarn pulled in, in the vacuum, sometimes I did it on purpose just so at the end, when I did it on purpose to get the yarn in there so, and you had to pull it out after you turn the thing off, and I said, well, he said, well, I think you better stop cleaning. But that was a job. We had to clean all that, you know, all the machines, you know, all the eye things, so, that was too much. So when I said, well, I said, I think we better, he said, and he said, we better stop at it, you know. And I used to read lips. I have a daughter that I adopted that’s deaf, you know, so the boss started turning their back to me because I could read their lips, whatever they were saying. I was, I still am partly that way. We think young, even though we’re seventy-one, like my friend is seventy-five, we still think young. We don’t think as we are now, the age we are, we don’t think of the age. We think when we’re young. But I was mischievous, too. So one time I was chewing bubble gum and I was making noise, you know, with the bubbles, so the boss told me to cut it out. Well I said, you’re interfering with your chewing gum now. Oh, I was, I was a hellion, too, in a way, you know. Not as much as the guys was, but I used to, you know. But that’s another room that I had a good time with the people, you know. And in fact I met one, Virginia, she’s going to Florida, she said, for three weeks. And I met her, and she’s seventy-nine now, and she looks good for her age, you know. So, I mean, it’s all people that I worked with. 5 Well, there’s a lot of bad stuff, I’m not telling you all the bad stuff that happened. Oh, one time, oh my gosh, one time, I started having white hair when I was fourteen, you know. And so the top was all white, so, and I had a friend so we bought a dye, and she said, bring the dye in, we’ll do it for you, I’ll do it in the mill. So I went, we caught up with our job, you know, and I bring it, we do that. So when the boss, I’ll never forget it, he’s superintendent there at the, now, I think he’s changed job now. He worked in North Carolina for a while, and Norman Levasseur, he was my supervisor. And he says, so I got the rinse so everybody was watching for him, so, even the guys, the fixer. So, and then I, we had a room, so I had to wait in there so (unintelligible phrase) stuff, then we went to the sink in the hallway and then rinse it out. And then after that the boss got on top of, he was looking, and I was scooching down, we had three rolls to pull up, you know, yarn, you know, the cones. So, and he says, then he got in front of the step, because I had to climb up to put the things on, and he says, he was looking and I was laughing like hell, and he said, whatever you did, don’t do it again. He knew I had a white spot, then it disappeared, it was black. That’s what happened in the fringe and, oh, we used, we had fun in that room, we had a lot of fun there, so, yeah. It’s, memories, oh, I have a lot more stuff, it will take you the whole day to hear everything (unintelligible phrase). One time we had, Dick Ricker was also a supervisor there, and we dress up for Halloween. Over there you dress up for Halloween, and Christmas, you had to decorate your place, your lights, you know, flourescent light, we had to decorate all that. And then we exchange gift, and everybody ordered something like country, not country, chicken, oh, voyons, a senior moment, you know. You know, the chicken, the fried chicken there?"
"AL:","Kentucky Fried Chicken?"
"LM:","Yeah, so we all, everybody had that, and they all brought that in, you know. So we, so it was good in a way that everybody had the same thing to eat, and we all sit down, took a break. So one time for Halloween everybody dressed up, you know, for Halloween, and so I was dressed as a witch, I think we were three witches in there. So with the supervisor, nobody had their teeth in, they took out their false teeth, and I took mine out, too, and I, I still have a picture of that. Even the supervisor, so you can see it was a friendly thing in a way, because even the supervisors, as long as the people enjoyed the, you know, enjoyed working there. When I went to work over here, at the (name) Press, there, after they closed out there, I missed the Bates Mill. I always said that you, you know, you appreciate more what you had. You complained, but yet at the same time you appreciate what you were doing. I would prefer Bates Mill than this any time, you know. So, and I said, that’s the thing that people didn’t appreciate what they did. One man complained and he said, oh, the Bates Mill is like this, the Bates Mill is like that. I said, I guess you sit your ass over here on the bench but you’re not working, doing anything. Go to work somewhere else and you’ll find out you’ll be working and you won’t like it either, you’ll appreciate the mill more than that, you know. So that’s what I told him, that time. I was not shy of saying what I thought, you know."
"AL:","Do you remember when the mills sponsored Maurice Chevalier?"
"LM:","Oh yes, I’ve got the magazine, 1966, I’ve got the book over here. Matter of fact, I’m supposed to bring it down, and there’s a twenty five years people, because I was out sick and Norman, my boss, called me up and he said, you can come over, and he said, I got tickets for you to come over, you can go over there. And I was out on sick leave, and that’s what he did, you know, so we, I went over, and I got the magazine over here, a small magazine. It was 1966. Because I look at it, and I (unintelligible word) terrific, and the name of the people, you know, is on it, and the pictures, you know. I got that to bring down there. Oh yes, oh, Maurice Chevalier, that’s one of my favorite, one of my favorite."
"AL:","Now, at the time you were working at the mill, did they still do the annual picnic in the summer? 6"
"LM:","Yes they did, yes they did, when we were there, yes, every time they had. That was a nice thing to do, they had the meal and everything. And they had a band that played music, also, you know. It was really nice. Like I said, we didn’t appreciate what we had then, but you do after. You do after. I enjoyed the place, really. And I even told them over here, where the new job I had, I told the boss, I was not shy, you know, and I said, you know, if the Bates Mill would call me today I’d leave this place and go right there now. That’s how I felt, you know. So, it’s the truth, I mean, you know, it’s, it was easier, I damage more my hands over here than I did at the mill, you know, so. Over there the, over there what you had, you could bring your lunch and you, like I had a box to bring my tea or coffee, you know, and stuff like that. That I did down in the fringe, you know. And so you can bring anything you wanted, and can cook it over there, you know, they have oven or so to do that. But some type of little stove, you know, to get things ready. And I had a little stove to cook my stuff on, like the soup, you know, and just warm it up and stuff like that, or the water for tea or coffee, you know. That’s what we did at that time. Well, the mill was, you know, it, we worked hard in a way, but yet at the same time, it was really great. (Pause in taping.)"
"AL:","And I wanted to ask you about whether you had an opportunity to get involved in some of the recreational activities that were sponsored by the mills, like the bowling league, or?"
