"person","text"
"LM:","Oh yes, I was on the bowling league, yes. We have, I’ve got pictures of that now, so, of the bowling league, with the people, yes, we celebrated. I always called my husband, though, I said, Gil, we’re gonna be done eating now, so you can meet us over here. Because I didn’t want him to be jealous or anything, than stay alone. And one time, I’ll never forget that, the girls was, the girls, we went to, after we ate we always went something else. There was a beer joint, I call it a beer joint, at the corner of, oh, it was right after you pass the bridge, where the Empire Bridge, there, it was right on the corner on your left if you’re going towards Auburn. And we used to stop over there, too. They did. I mean, I was not the type to go there, but I did because it was with a group. And so one time we landed up with a Detective Cloutier, and I said, all the girls were there when Germaine Guay, yeah, Guay, was, that was her brother. And so we went over there, it was four o’clock in the morning and I said, look, I was the only one that didn’t drink so, and I brought them home after, you know. So, and I said, look, if you don’t want them to stay over here overnight, I said, I’m leaving now and you’re going to bring them home. I said, either they go home now, or anything. So anyhow, I had to bring the girls home, so I was not that lucky to get away from it, so. So I, I told my husband, if you’d come in at four o’clock in the morning, I’d kill you. You, I don’t trust, but me, I trust me. I used to say that, you know, and I still do say it sometimes, you know. I say, see my little nose there? That’s as far as I trust you, so. Oh, I have fun. You have to have a sense of humor in life. If you don’t, you know. Now, getting back to Muskie, there, I had my picture taken with him at the convention we had at the Bates Mill, we had a picnic thing, so, so it was a convention. I forgot the year now that was, so, and a couple of time I met some people, they told me, oh, I see your picture with Muskie in the Icon. I’ve got the big picture here, too. And they said, it’s at the Bates College. I’d say, it is? Hmmm, I didn’t think I was that popular, you know. But it was up there, and I had a hamburger in my hand, and I put it behind me, so, but we had our picture taken. Olympia Snowe, I had my picture taken with her an awful lot. So the people that came in. I was active in the, I was in the bowling league, and also we were in a group and just after (unintelligible phrase), I forgot what we called it. If there was any problem that we had a meeting with Ray Bissonette and other people, you know, from different departments, and they would discuss what was wrong, what should be, you know, going on. So I worked in a group like that also. 7 And one time we had a State parade, and they made me a dress out of the corded blankets, there, and we were in the State parade. Ray was supposed to be my, Ray Bissonette was supposed to be my husband and he had a vest, I mean a jacket, smoking jacket on, and I had that full dress."
"AL:","And what’s his last name?"
"LM:","Ray Bissonette, yeah Bissonette, and so we were in a float, you know, for the parade, the State parade, I was involved in that. And I had a mouth, if I was not happy, I almost got to be a shop steward one time because, I didn’t get, and I was glad, too, because it was too big, too much, you know, with the kids, I had six, seven kids over here, one adopted so, I had six but we had seven in all. So, and I said, it would have been too much. But if I didn’t like anything, oh, what was his name again? I know, I got it there, the one with the union, the head of the union at that time, and I used to jump on his back all the time. I’d say what should be, what shouldn’t be, you know, so, win our case over there."
"AL:","Not the, the regional agent was Denis Blais."
"LM:","Denis Blais, but it’s not him that we, it was the other one that was the head of the shop steward there."
"AL:","Gosselin?"
"LM:","No. If I hear his name I know I’d hear it. Cloutier, I think? No?"
"AL:","Maybe, I don’t know."
"LM:","I, gosh, forgot his name."
"AL:","That’s okay."
"LM:","Out of sight, out of mind I guess."
"AL:","Do you recall any strikes at the mill while you were there?"
"LM:","Oh yes, there was a strike there, yeah, a couple times that we had strikes in there. But I didn’t, I didn’t get involved too much. I went to the meeting, and there was a time that I never went to meetings because with the big family I had, you know, I had to take care of that. But there were, yeah, we had strikes, but like I said, I didn’t, I went to a meeting one time. And I think we won our case. Yeah, we won that time. So, but I didn’t go for it too much, you know. I was not the type of person that went for the strike, because you lose your job and all that. But we did gain anyhow, whatever we went for. I don’t remember what it is today."
"AL:","Wages? There were wage increases?"
"LM:","Yeah, wages, insurance especially, you know, insurance, yeah. At the end they had, we had the cards with our name on it, punching, you know, that was something new they started, which was good, you know. That way you didn’t, you were on time. I was always on time. I was half an hour earlier than I was supposed to be. And that’s still the same thing over here, too. So, I’m the type of person that, doctors, hairdressers, and church, you can’t be late, you have to be on time. Ahead of time, half an hour."
"AL:","Now, did you say that your husband also worked in the mill?"
"LM:","Yes, he did. Not as much as I did, but he worked at the Hill Mill a little bit, and then, he was doing two or three jobs at that time, when he was doing that. Then he went to work at Bates as a weaver, and then he fixed the problem, he has an intelligent mind, you know, so he could fix his work, you know. He 8 wanted to do that, but then he didn’t stay there too long. He got to be a carpenter after that. He’s the one that did all this here, the kitchen. So, no, so after that he stopped that and then he work, couldn’t see it. And my kids, I told them, go to school or otherwise you’ll end up working in textile mill or shoe shops or anything. Which now we don’t have anything left anyhow, the shoe shops and all that, so, the mill. It’s a sad sight to see the mill all down. There used to be Hill blocks, that, I look for pictures like that, the Hill block. The Sun and Journal must have pictures, because it’s been, because I told her, I told her, I said, you know, there’s some pictures of the Hill block, and which I don’t see it. And, because there was a lot, you know, we used to stay there, too, a little bit when we were kids, younger."
"AL:","Now, when you worked at the mill, what shift did you work on?"
"LM:","First I started on third shift, and I got sick to my stomach, I couldn’t work on such a, I (unintelligible word) quite a bit over there on the third shift. Then I tried to, you have to sign up for a job, you know, for any other shift you wanted, you know. If you were next, you could get it. Then I went to a second shift, and I was a lot of years on second shift until, wait a minute, how old was the youngest one? I was here when we, yeah, let’s see, it was the second shift a long time, and then I finally got to be on the first shift. So that was the better shift to work on, you know. But second shift, I’d been years on it, I always worked on second shift, I was used to it. Because he worked third shift or first shift, and I worked second. Because I told him, you can’t take the, when he went to the mill, I said, you can’t be the same shift as I am, you have to do a different one. You can’t take second either, because I’m on second. So, I didn’t want to change, you know."
"AL:","Yeah, because raising your family, you couldn’t both be on the same shift."
"LM:","No, no, so it would have (unintelligible phrase). I used to spend ten dollars a week for a babysitter, compared to what they do today? My God, what a difference. We didn’t make much at that time, but wages wasn’t high like it is today, but things wasn’t expensive like today either, you know. So that’s a big difference there. But yeah, he did work in the mill a little bit, but not too long, though, because he, and after that he started to be a carpenter. So that’s what he’d been doing. Now he’s retired, we’re both retired. Not retarded, retired."
"AL:","Now, looking back on your time at the mill, is there anything that I haven’t asked you about that you think is important to add?"
"LM:","You know, sometimes when we do something like this then we always thing after you’re gone, well, I should have said this, I should have said that, you know. Sometimes (unintelligible phrase) quickly, it’s, I think we talked about all the departments that I worked in, and the people. I see Jack Russell, he’s 90 years old, he was a supervisor also, it’s a really nice man, he was in the cloth room. And I see him once or twice a year, I see him with his wife. Beautiful people."
"AL:","And did you know Fred Lebel?"
"LM:","Oh yes, Fred Lebel, yes, I knew him. Really nice, really nice man. And I met his sister-in-law. His wife, I don’t remember if I’ve ever seen her, but I don’t remember. But his sister-in-law Sandy, I know here real well. And Fred, oh yes, very pleasant, he always tells you hi, you know. Even today, you know, if you see him he says, hi, how are you, you know. And what’s his name, and Burgess, Larry Burgess always called me Lilly Ann, you know, pronounced the Ann, you know, more than anything. I like that, too, so, the way it was. It was really a nice place. Phil Morrow, runs the credit union there, so he worked there, too. We see each other once in a while, you know. I see a lot of people that, like I said, that we worked together, and it was really fun. As far as the, if I forgot anything, I don’t know if we did. 9"
"AL:","Any funny stories that you haven’t told yet?"
"LM:","Oh my gosh. I used to, I remember I used to help Ray Berube do his, he was a, he had eight kids I think, and I think it was mostly all girls. And he used to take airplane lessons, you know, so in the weave room, well we always, we were sitting down on our break and then I help him, ask questions about him driving a plane. And he was a skater also. Never went in his plane. I wouldn’t have either. But he, and that’s one room. Oh, stories, we have Gerry Laliberte that, and I don’t remember them, though, he used to tell us jokes all the time. Oh, that guy. He’s passed away, now, though, last year I think he did. And he always tells us jokes. And I had a very good friend Anita. There was two women who brought wine, not wine, brandy, you know, to, for Friday night, we had, we all did supper and, you know, the boss let us do that, and those girls had wine with foil covered on it. That was a no-no, but still they did that. And so one time they gave us, gave Gerry a cup, a little bit, and so I had, so they gave me a sip, so I took a sip, Gerry gave me that, and then my friend Anita, Anita (name), she went over and he says, here, try it, Anita. So she took the cup and walk away with it. She drank it all. That’s one thing that happened. Oh, there’s a lot of little things that happened that we remember, you know, but sometimes you forget it. You have to think about it, you know. Senior moment is very easy to get, you know, today. Out of sight, out of mind, it’s even worse. What else, what else? As far as the picnic, we had quite good picnics, and we had, oh, they had a ballroom, they had an orchestra one time for dancing, you know, and a supper and all that, we had that, too. It happened, I don’t remember the year now, I forgot it. I think we had it only once, if I remember correctly, while I was there. But the seniors, the one that twenty-five years got a lot of celebration, you know, every time they were twenty five or over they got celebration and a pin. I got my twenty-five year pin, also, over there. What else, what else? The weave room, the Number Five, like I said, was the best one. And Number One and Two was not as great as the others. But that’s the shift I got sick a lot, that’s where I worked, in Number One and Two when I was on third shift."
"AL:","Did you know any of the employees that were on the famous hockey team?"
"LM:","No, because I was not too much in it as, I was not a, didn’t have time for sports, you know, with my kids, eh, so, all I know is, no, we didn’t, we took movies of (unintelligible phrase). Especially Christmas, we have Joe Gravel, who was also a supervisor, and Roger (name) who dressed up as Santa Claus, you know, we were a group of people in the Number Five, you know, they took our picture there, so. I still have that, that shot, I have that. I should give that to the Bates, because the kids won’t remember the people, you know, that’s in there. If you’re not in the picture, you know, they won’t remember it. Still, they won’t keep that because be all strangers to them, you know. But I’d like to give that, have a tape, I don’t know anybody who does a copy of the video that I have. We took the movies, we put it on video, of the Bates Mill, you know, with the group there. Do you know anybody?"
"AL:","I will talk to Rachel about that."
"LM:","Yeah, because I like to have, I like to give that to the Bates. It would be nice if they had that, that section of the Bates Mill with Ray, and there was Paul Bernier. He walked pretty fast, I saw him, he walked pretty fast, you know. But Ray, you could see him good, and me, you could see me feeding, getting ready to feed the machine there, the battery hand in Number Five there. So, but as far as jokes, I don’t remember, too. I’m not a good joke teller, but I like to hear them, you know. I don’t know what else we could say about the place, except I loved it. Thinking about it now in the past, there, talking about it reminds me of a lot of stuff, you know, that we did over there, we 10 worked over there. Except my partner on the sealer was Lorraine Demers, she was a single woman. And her, she went, every time she buys a sandwich she just took a bite off of it and throw it away in the trash after. And I said, do you know there’s a lot of poor people are going hungry, and I said, they’re starving and you take that sandwich and throw it away? You wasted it? So I kept on and on, and then she, she put her hand like this, she goes in the trashcan, she said, here’s the sandwich, eat it now. So the women next to me, a sealer, Anna and Bertha, they took the sandwich and put it on the side of the window to feed the pigeons. Oh, I’ll never forget her. She used to smoke an awful lot, oh, God, she’s a smoker. But that was my partner to work with, you know. We had fun over there, too. Oh, my gosh. I had a lot of bad things in there, too, so."
"AL:","Thank you very much for your time."
"LM:","You’re very welcome."
