"person","text"
"RR:","I says, okay, anything else. She says, isn't that enough . I almost told her, why didn't you let me die. I went to Social Security and I told her, well, you can call her up. She called up my mother. She says, I want to speak to the woman that brought him in the world . I says, you realize she doesn't understand English. She says, I understand French . She says, what happened to him . She told them . That was it. Now I've picked up hobbies. The doctor at Social Security told me, Mr. Roy, now that you are retired, don't stay in bed. I says, what am I gonna do. Get up, do the same thing that you were doing when you went to work. Don't bring your lunch bucket, don't bring your tool chest. I says, what am I gonna do. He says, go for a walk around the city, at least a mile. Then pick up a hobby, making puzzles, bike riding, do this, he says, don't worry about the money, you'll have a full paycheck coming in. And if you need help in planning, we 'll do it for you . So I bought a bike. Every morning I'd take off in a different direction . And when it got to a point where I was fed up with the bike. I says, well, I should do something else. Somebody met me in the store, they said, hey, what are you doing for excitement. Nothing, I put my bike away. He says, why don't you buy yourself a cam corder and visit places, take pictures of places. I says, that's an idea. It caught on. I got the cam corder and I started, if there's a house being built, you know that big hotel in Auburn, I got that on film . I got the St. Mary's emergency room on film . I got the other building on Gracelawn on film . And when I hear something else is being built, I go over there, I film it. And one day I was on , you know when they put up the bridge on Main Street, the Veterans Bridge. I was there, looking around, visualizing that. One morning I was there, and who did I see, the Sun-Journal man. I said, hi, how are you. He says, fine. He says, what are you doing . I said , I've got a hobby, and I'm taking pictures of th is construction and all that. He says, do you mind if I follow you around. I says, what for. He says, you 're a hobbyist, ain't you. I says, yeah . He says, I take anything that moves. You're retired . I says, yeah . He says, you 're taking pictures of this. I says, yeah . He says, do your thing, and let me do mine. I says okay. So I started walking around , they were laying pipe there, so I went there and I was watching them laying pipe. All of a sudden, I got up the next morning, I look in the paper, I says, oh no. Front page (unintelligible). I laughed . I called up the guy, I says, you sneak. Well, he says, now I'm getting to know you, GAN is getting to know you, CSH knows you, Channel 8 knows you . And he says, when they see you someplace, you're going to be it, and you 're going to be a hit. I says, I got noth ing to lose. I'm still doing it."
"AL:","That's wonderful."
"RR:","But now (unintelligible) I've to this awful scoliosis business. I've got arthritic business. It's terrible."
"AL:","What did your dad do for work?"
"RR:","He was a carpenter. He built, he took the house that, well , when they started they used to live on Bartlett Street, and they wanted to get out of there. So they went out on Bell Avenue, the same place I told you I was born. He took a house that was about the size of this room and he added on to it. He was a finish carpenter. When my mother told him, we have another one coming, he'd look around to see where he could put another room. So, one there, one there, one there and the house got big. There was twelve of us, so we had a big kitchen downstairs, they had a big living room , they had two bedrooms, and they had the kitchen, cooking kitchen and the heating kitchen in the back. It didn't seem to do any good. It heated a quarter of the house. He says, I got to do something. So what he did, he went upstairs. He opened up a second floor, adding more rooms, add this one, add that one, add that one. By the time he was done he had a bathroom upstairs, he had a big middle hallway. He had three, four bedrooms. We all slept upstairs. I was thinking, if I would have known this, I would have brought my cam corder and I wou ld have showed you what the house looked like. It's all on DVDs and cassettes. Somebody mentioned to me the other day, why don't you have your cassettes turned into DVDs, because I've got a huge DVD set that I bought. So I called the person who made them. Ten bucks an hour. I says, no thank you . If a tape is two and a half hours long, that's a lot of money involved. I've got a hundred twenty five tapes. So I says no, I'll leave them this way. The guy from the Sun Journal was doing, after he did that, he says do you mind if I go to your place for an interview. I says no. So he came up to my place and he says, you sit in your chair and you work on your tapes, and I'll interview you. I was doing that, this one goes there, that one goes there. Man, did he do a job."
"AL:","That's really neat. And you were one of twelve children."
"RR:","One of twelve."
"AL:","And you must have been one of the youngest."
"RR:","Third youngest."
"AL:","That's a big family ."
"RR:","My father died at the age of eighty-three, and mom died at the age of eighty-nine."
"AL:","They lived long lives. Is there anything else that you want to add , that I haven't asked you?"
"RR:","Like what?"
"AL:","Anything. Relating to shoes, or your family. Before we end today, I just want to give you a chance to fill in something that I didn't think to ask."
"RR:","Well like I said, I come from twelve and I'm third youngest, so there's two of them departed, and the two departed were hand sewers. Morris was a hand sewer, and Roger was a hand sewer. They never had a shoe back that was done wrong, never. I remember when I was at Billings, I had done a shoe, and it didn't come out too good. The foreman looked at me, and I says, oh no, what did I do now, I says, what's wrong. He says, this thing is crooked. Look at it, it's a little too high. So Larry Daigle then came by, he says, what's wrong with the shoe. I said I don't know, it's crooked . He says, that's nothing. He says throw it back in the water. When it was wet, he says, I'll show you something, he says, if it's this way, put it in the water, but it back on your jack, and just take a tack puller with the two prongs this way, just take it that way, just pull, and it's going to pull the leather right back where it belongs."
"AL:","Well, thank you so much."
"RR:","You 're quite welcome."
