"person","text"
"JT:","Well growing up, you know, the forties and fifties, there wasn't a lot of wealth in the community. People, the bulk of the people worked in the mills, bulk of the people took buses, the L and A Transit System. I can remember buses lining up on Lisbon Street during the shift changes. Lisbon Street was a two-way street back then, it was actually until two years after I graduated from high school, it was two-way. I came back from the military, borrowed my dad's car, and immediately took a right hand turn on Lisbon Street, and wondering why all the cars were coming at me and tooting their horns. They had changed it to a one-way street. But people paid cash, there was no such thing as credit cards. They thought Franklin Delano Roosevelt sat at the right hand of God, he saved us. They were hard workers, the men worked two jobs or two shifts most of the time, women stayed home, took care of the kids. Some women went to work, but not many. Kids that went to work, my wife for example worked in the mills. Her paycheck went to her parents, and they gave her an allowance, and that was typical. Today, I mean, there was very few automobiles. Goff Hill was a playground for us kids. In the winter time we could slide down Goff Hill, if you dared, no traffic. (Unintelligible) down, you'd end up about where C.V.'s was, C.V.'s would be right across from where Denny's is right now, it was C.V.'s, or Mac's Variety. And when there was no snow, the next big challenge was to take your bicycle and try to go down Goff Hill without getting half killed. The other challenge was trying to pedal up Goff Hill, which was a real challenge. Again, we could do all of that stuff, very little traffic, people didn't own, very few people owned cars. Virtually no crime in the city. I mean the parents never worried about us. We'd leave the house after breakfast and then show up for dinner maybe, and then we'd play outside all day, and we all had tans and there were no skinny kids [sic] and all we'd do is run around, playing Indians and cowboys and other games that we could think of, tag, hide-n-seek, ride our bikes. I remember getting on my bike and with my friends pedaling out to Lake Auburn, going up Center Street in Auburn. Center Street in Auburn , by today's (unintelligible), was barely enough room for one car."
"AL:","Really. And would you go down Lake Shore Drive?"
"JT:","All day thing. We'd even pedal out to Taylor Pond."
"AL:","Did they have Tabor's Ice Cream then?"
"JT:","Yeah, Tabor's has always been around, in my recollection."
"AL:","My next door neighbors are married, they're up close to eighty, and they worked there as teenagers."
"JT:","Yeah, it's always been. And the building, the caddy- I say caddy shack- the shack where they give you the balls and stuff, that hasn't changed, that's the same as it was back when I was a kid . Even the store where they sell, it's changed very little. The tees are all in the same place. One of the few things around that hasn't changed. All the shoe shops are down, some of the banks that were in Auburn, that were next to the river, they're all gone, where the Hilton Hotel was, in that area, there was, where you cross the bridge, I think it was the Auburn Savings was right there on the river. I think somebody coming to the L-A area today out of that era, you know, if they left and they hadn't come back, they'd have a hard time getting around. They'd recognize some of the buildings on Lisbon Street, and of course Peck's, well it's not Peck's any more, it's L. L. Bean. Peck's was the, that was the store back then, Peck's and then Penney's right next to it. And I can remember going into Peck's as a kid, my mother would buy me a pair of shoes and they had an x-ray machine - today of course it would be a health hazard - but you put your feet in there and you could see your bones. The reason they did is to see if the shoes were crowding your bones, to see that the shoes were a good fit, that was the purpose of it. And they actually had elevator girls, you'd get on the elevator and there was a girl there that would open the door for you, and announce the floor as she was going up, you know, lingerie, menswear, so forth , each floor had a different name."
"AL:","So it really made it kind of an experience to go shopping."
"JT:","Oh yeah, Peck's was the place to go shopping. And after Peck's it was Penney's, right next door. Penney's now is Human Resources, the state Human Resources building. They've remodeled it so much I don't recognize it, but a few years ago, before they remodeled it, I remember going in there and recognizing some of the structures that hadn't really changed . The Strand Theater, we had lots of theaters in Lewiston and Auburn. In Auburn there was the Auburn Theater, next to the courthouse, and the Community Theater in New Auburn. The Auburn Theater still had vaudeville, we'd go there on Saturday and we'd see two motion pictures or cartoon (unintelligible) for eleven cents. Later on the Ritz Theater, which is still there and it's, L.A. Arts I think is, something like that. But we'd walk there on Saturday afternoon, again it was two motion pictures, or a serial, Captain Marvel or Superman cartoons, parents could get rid of us for a whole day, just, and they knew where we were, we were at the theater. And I think back then, under twelve it was nine cents to get in. And you had the Empire Theater, which recently got torn down. That was the theater where they had one show, it was usually the first run , and you paid more money to get in to see that one. And then up from that was the Strand Theater, which, it was quite a theater, they had a balcony that used to make me dizzy, it was so high. You'd get up there in that balcony and just, my head would, I'd get dizzy, it was just, but we used to like to go up there because we could shoot popcorn over the edge and irritate the people underneath. So, those are all gone. The Community Theater building is still there, but it's a catering outfit that works out of there now. Strand got torn down, there's a gas station where the Strand used to be."
"AL:","Where was the Strand, can you describe that?"
"JT:","It was just up from where Human Resources is, on the same side. In those days people went to the, there was no TV so they went to the movies, and especially on the weekends, I remember there'd be lines all the way down Main Street, waiting to get into the theater, people would just wait one or two hours just to go in and see a motion picture. Those were the days when Dean Martin and Jerry Lewis were a team. So, you don't see that today, that's all different."
"AL:","Well thank you so much, that's wonderful descriptions, I appreciate your time."
"JT:","You're welcome."
